17:02:28.893860 IP 192.168.10.158.54476 > 192.168.10.1.domain: 24932+ A? www.naver.com. (31)
17:02:28.906424 IP 192.168.10.1.domain > 192.168.10.158.54476: 24932 3/0/0 CNAME www.naver.com.nheos.com., A 125.209.222.142, A 125.209.222.141 (97)
17:02:28.906915 IP 192.168.10.158.35144 > 125.209.222.142.http: Flags [S], seq 356400865, win 29200, options [mss 1460,sackOK,TS val 1182966 ecr 0,nop,wscale 7], length 0
17:02:28.915374 IP 125.209.222.142.http > 192.168.10.158.35144: Flags [S.], seq 2027554171, ack 356400866, win 8190, options [mss 1460,nop,wscale 2,nop,nop,sackOK], length 0
17:02:28.915396 IP 192.168.10.158.35144 > 125.209.222.142.http: Flags [.], ack 1, win 229, length 0
17:02:28.915608 IP 192.168.10.158.35144 > 125.209.222.142.http: Flags [P.], seq 1:394, ack 1, win 229, length 393: HTTP: GET / HTTP/1.1
17:02:28.925378 IP 125.209.222.142.http > 192.168.10.158.35144: Flags [.], ack 394, win 3936, length 0
17:02:28.925929 IP 125.209.222.142.http > 192.168.10.158.35144: Flags [P.], seq 1:395, ack 394, win 3936, length 394: HTTP: HTTP/1.1 302 Moved Temporarily
17:02:28.925941 IP 192.168.10.158.35144 > 125.209.222.142.http: Flags [.], ack 395, win 237, length 0
17:02:28.927209 IP 192.168.10.158.40908 > 125.209.222.142.https: Flags [S], seq 2234343484, win 29200, options [mss 1460,sackOK,TS val 1182971 ecr 0,nop,wscale 7], length 0
17:02:28.936259 IP 125.209.222.142.https > 192.168.10.158.40908: Flags [S.], seq 2127841672, ack 2234343485, win 14480, options [mss 1440,sackOK,TS val 4282318086 ecr 1182971,nop,wscale 7], length 0
17:02:28.936283 IP 192.168.10.158.40908 > 125.209.222.142.https: Flags [.], ack 1, win 229, options [nop,nop,TS val 1182973 ecr 4282318086], length 0
17:02:28.936408 IP 192.168.10.158.40908 > 125.209.222.142.https: Flags [P.], seq 1:202, ack 1, win 229, options [nop,nop,TS val 1182973 ecr 4282318086], length 201
17:02:28.944644 IP 125.209.222.142.https > 192.168.10.158.40908: Flags [.], ack 202, win 122, options [nop,nop,TS val 4282318095 ecr 1182973], length 0
17:02:28.947110 IP 125.209.222.142.https > 192.168.10.158.40908: Flags [.], seq 1:1449, ack 202, win 122, options [nop,nop,TS val 4282318097 ecr 1182973], length 1448
17:02:28.947127 IP 192.168.10.158.40908 > 125.209.222.142.https: Flags [.], ack 1449, win 251, options [nop,nop,TS val 1182976 ecr 4282318097], length 0
17:02:28.947736 IP 125.209.222.142.https > 192.168.10.158.40908: Flags [.], seq 1449:2897, ack 202, win 122, options [nop,nop,TS val 4282318097 ecr 1182973], length 1448
17:02:28.947742 IP 192.168.10.158.40908 > 125.209.222.142.https: Flags [.], ack 2897, win 274, options [nop,nop,TS val 1182976 ecr 4282318097], length 0
17:02:28.948544 IP 125.209.222.142.https > 192.168.10.158.40908: Flags [P.], seq 2897:6557, ack 202, win 122, options [nop,nop,TS val 4282318097 ecr 1182973], length 3660
17:02:28.948553 IP 192.168.10.158.40908 > 125.209.222.142.https: Flags [.], ack 6557, win 331, options [nop,nop,TS val 1182976 ecr 4282318097], length 0
17:02:28.949202 IP 192.168.10.158.40908 > 125.209.222.142.https: Flags [P.], seq 202:328, ack 6557, win 331, options [nop,nop,TS val 1182976 ecr 4282318097], length 126
17:02:28.955192 IP 192.168.10.158.40908 > 125.209.222.142.https: Flags [P.], seq 328:381, ack 6557, win 331, options [nop,nop,TS val 1182978 ecr 4282318097], length 53
17:02:28.955653 IP 192.168.10.158.40908 > 125.209.222.142.https: Flags [P.], seq 381:753, ack 6557, win 331, options [nop,nop,TS val 1182978 ecr 4282318097], length 372
17:02:28.959142 IP 125.209.222.142.https > 192.168.10.158.40908: Flags [P.], seq 6557:6815, ack 328, win 122, options [nop,nop,TS val 4282318109 ecr 1182976], length 258
17:02:28.960415 IP 125.209.222.142.https > 192.168.10.158.40908: Flags [P.], seq 6815:6884, ack 328, win 122, options [nop,nop,TS val 4282318110 ecr 1182976], length 69
17:02:28.960519 IP 192.168.10.158.40908 > 125.209.222.142.https: Flags [.], ack 6884, win 354, options [nop,nop,TS val 1182979 ecr 4282318109], length 0
17:02:28.960643 IP 192.168.10.158.40908 > 125.209.222.142.https: Flags [P.], seq 753:791, ack 6884, win 354, options [nop,nop,TS val 1182979 ecr 4282318109], length 38
17:02:28.964690 IP 125.209.222.142.https > 192.168.10.158.40908: Flags [.], ack 753, win 130, options [nop,nop,TS val 4282318114 ecr 1182978], length 0
17:02:28.967873 IP 125.209.222.142.https > 192.168.10.158.40908: Flags [P.], seq 6884:6922, ack 753, win 130, options [nop,nop,TS val 4282318114 ecr 1182978], length 38
17:02:28.976359 IP 125.209.222.142.https > 192.168.10.158.40908: Flags [P.], seq 6922:10870, ack 753, win 130, options [nop,nop,TS val 4282318124 ecr 1182979], length 3948
17:02:28.976371 IP 192.168.10.158.40908 > 125.209.222.142.https: Flags [.], ack 10870, win 415, options [nop,nop,TS val 1182983 ecr 4282318114], length 0
17:02:28.976389 IP 125.209.222.142.https > 192.168.10.158.40908: Flags [.], seq 10870:13766, ack 753, win 130, options [nop,nop,TS val 4282318124 ecr 1182979], length 2896
17:02:28.976392 IP 192.168.10.158.40908 > 125.209.222.142.https: Flags [.], ack 13766, win 461, options [nop,nop,TS val 1182983 ecr 4282318124], length 0
17:02:28.976857 IP 125.209.222.142.https > 192.168.10.158.40908: Flags [P.], seq 13766:15004, ack 753, win 130, options [nop,nop,TS val 4282318124 ecr 1182979], length 1238
17:02:28.976868 IP 125.209.222.142.https > 192.168.10.158.40908: Flags [.], seq 15004:16452, ack 753, win 130, options [nop,nop,TS val 4282318124 ecr 1182979], length 1448
17:02:28.976874 IP 192.168.10.158.40908 > 125.209.222.142.https: Flags [.], ack 16452, win 506, options [nop,nop,TS val 1182983 ecr 4282318124], length 0
17:02:28.978362 IP 125.209.222.142.https > 192.168.10.158.40908: Flags [.], seq 16452:17900, ack 753, win 130, options [nop,nop,TS val 4282318124 ecr 1182979], length 1448
17:02:28.980091 IP 125.209.222.142.https > 192.168.10.158.40908: Flags [P.], seq 17900:19138, ack 753, win 130, options [nop,nop,TS val 4282318124 ecr 1182979], length 1238
17:02:28.980112 IP 192.168.10.158.40908 > 125.209.222.142.https: Flags [.], ack 19138, win 551, options [nop,nop,TS val 1182984 ecr 4282318124], length 0
17:02:28.984327 IP 125.209.222.142.https > 192.168.10.158.40908: Flags [.], seq 19138:20586, ack 791, win 130, options [nop,nop,TS val 4282318135 ecr 1182979], length 1448
17:02:28.985311 IP 125.209.222.142.https > 192.168.10.158.40908: Flags [.], seq 20586:22034, ack 791, win 130, options [nop,nop,TS val 4282318135 ecr 1182979], length 1448
17:02:28.985327 IP 192.168.10.158.40908 > 125.209.222.142.https: Flags [.], ack 22034, win 596, options [nop,nop,TS val 1182985 ecr 4282318135], length 0
17:02:28.986724 IP 125.209.222.142.https > 192.168.10.158.40908: Flags [.], seq 22034:24930, ack 791, win 130, options [nop,nop,TS val 4282318135 ecr 1182979], length 2896
17:02:28.986739 IP 192.168.10.158.40908 > 125.209.222.142.https: Flags [.], ack 24930, win 642, options [nop,nop,TS val 1182986 ecr 4282318135], length 0
17:02:28.988112 IP 125.209.222.142.https > 192.168.10.158.40908: Flags [.], seq 24930:32170, ack 791, win 130, options [nop,nop,TS val 4282318137 ecr 1182983], length 7240
17:02:28.988130 IP 192.168.10.158.40908 > 125.209.222.142.https: Flags [.], ack 32170, win 755, options [nop,nop,TS val 1182986 ecr 4282318137], length 0
17:02:28.988900 IP 125.209.222.142.https > 192.168.10.158.40908: Flags [P.], seq 32170:33340, ack 791, win 130, options [nop,nop,TS val 4282318137 ecr 1182983], length 1170
17:02:29.003829 IP 192.168.10.158.54476 > 192.168.10.1.domain: 35013+ A? s.pstatic.net. (31)
17:02:29.004519 IP 192.168.10.158.54476 > 192.168.10.1.domain: 52964+ A? ssl.pstatic.net. (33)
17:02:29.008340 IP 192.168.10.1.domain > 192.168.10.158.54476: 35013 8/0/0 CNAME s.pstatic.net.nheos.com., CNAME s.pstatic.net.e.navercdn.com., A 182.162.92.209, A 182.162.92.210, A 182.162.92.211, A 182.162.92.212, A 182.162.92.207, A 182.162.92.208 (203)
17:02:29.009124 IP 192.168.10.158.38156 > 182.162.92.209.https: Flags [S], seq 2780185314, win 29200, options [mss 1460,sackOK,TS val 1182991 ecr 0,nop,wscale 7], length 0
17:02:29.009191 IP 192.168.10.158.38158 > 182.162.92.209.https: Flags [S], seq 25320563, win 29200, options [mss 1460,sackOK,TS val 1182991 ecr 0,nop,wscale 7], length 0
17:02:29.009237 IP 192.168.10.158.38160 > 182.162.92.209.https: Flags [S], seq 3003660635, win 29200, options [mss 1460,sackOK,TS val 1182991 ecr 0,nop,wscale 7], length 0
17:02:29.010921 IP 192.168.10.1.domain > 192.168.10.158.54476: 52964 8/0/0 CNAME ssl.pstatic.net.nheos.com., CNAME ssl.pstatic.net.e.navercdn.com., A 182.162.92.205, A 182.162.92.206, A 182.162.92.201, A 182.162.92.202, A 182.162.92.203, A 182.162.92.204 (209)
17:02:29.011189 IP 192.168.10.158.60284 > 182.162.92.205.https: Flags [S], seq 2875353806, win 29200, options [mss 1460,sackOK,TS val 1182992 ecr 0,nop,wscale 7], length 0
17:02:29.017489 IP 182.162.92.209.https > 192.168.10.158.38156: Flags [S.], seq 3919230006, ack 2780185315, win 14480, options [mss 1460,sackOK,TS val 2121337311 ecr 1182991,nop,wscale 7], length 0
17:02:29.017517 IP 192.168.10.158.38156 > 182.162.92.209.https: Flags [.], ack 1, win 229, options [nop,nop,TS val 1182993 ecr 2121337311], length 0
17:02:29.017698 IP 192.168.10.158.38156 > 182.162.92.209.https: Flags [P.], seq 1:202, ack 1, win 229, options [nop,nop,TS val 1182993 ecr 2121337311], length 201
17:02:29.019148 IP 182.162.92.209.https > 192.168.10.158.38158: Flags [S.], seq 11658537, ack 25320564, win 14480, options [mss 1460,sackOK,TS val 2121337311 ecr 1182991,nop,wscale 7], length 0
17:02:29.019173 IP 192.168.10.158.38158 > 182.162.92.209.https: Flags [.], ack 1, win 229, options [nop,nop,TS val 1182994 ecr 2121337311], length 0
17:02:29.019191 IP 182.162.92.209.https > 192.168.10.158.38160: Flags [S.], seq 3506649050, ack 3003660636, win 14480, options [mss 1460,sackOK,TS val 2121337311 ecr 1182991,nop,wscale 7], length 0
17:02:29.019201 IP 192.168.10.158.38160 > 182.162.92.209.https: Flags [.], ack 1, win 229, options [nop,nop,TS val 1182994 ecr 2121337311], length 0
17:02:29.019210 IP 182.162.92.205.https > 192.168.10.158.60284: Flags [S.], seq 1865294386, ack 2875353807, win 14480, options [mss 1460,sackOK,TS val 2117548521 ecr 1182992,nop,wscale 7], length 0
17:02:29.019219 IP 192.168.10.158.60284 > 182.162.92.205.https: Flags [.], ack 1, win 229, options [nop,nop,TS val 1182994 ecr 2117548521], length 0
17:02:29.019335 IP 192.168.10.158.38158 > 182.162.92.209.https: Flags [P.], seq 1:202, ack 1, win 229, options [nop,nop,TS val 1182994 ecr 2121337311], length 201
17:02:29.019485 IP 192.168.10.158.38160 > 182.162.92.209.https: Flags [P.], seq 1:202, ack 1, win 229, options [nop,nop,TS val 1182994 ecr 2121337311], length 201
17:02:29.019560 IP 192.168.10.158.60284 > 182.162.92.205.https: Flags [P.], seq 1:204, ack 1, win 229, options [nop,nop,TS val 1182994 ecr 2117548521], length 203
17:02:29.025684 IP 182.162.92.209.https > 192.168.10.158.38156: Flags [.], seq 1:1449, ack 202, win 122, options [nop,nop,TS val 2121337319 ecr 1182993], length 1448
17:02:29.025702 IP 192.168.10.158.38156 > 182.162.92.209.https: Flags [.], ack 1449, win 251, options [nop,nop,TS val 1182995 ecr 2121337319], length 0
17:02:29.026623 IP 182.162.92.209.https > 192.168.10.158.38156: Flags [P.], seq 1449:3652, ack 202, win 122, options [nop,nop,TS val 2121337319 ecr 1182993], length 2203
17:02:29.026635 IP 192.168.10.158.38156 > 182.162.92.209.https: Flags [.], ack 3652, win 286, options [nop,nop,TS val 1182996 ecr 2121337319], length 0
17:02:29.027916 IP 192.168.10.158.38156 > 182.162.92.209.https: Flags [P.], seq 202:328, ack 3652, win 286, options [nop,nop,TS val 1182996 ecr 2121337319], length 126
17:02:29.028089 IP 182.162.92.209.https > 192.168.10.158.38158: Flags [.], seq 1:1449, ack 202, win 122, options [nop,nop,TS val 2121337321 ecr 1182994], length 1448
17:02:29.028106 IP 192.168.10.158.38158 > 182.162.92.209.https: Flags [.], ack 1449, win 251, options [nop,nop,TS val 1182996 ecr 2121337321], length 0
17:02:29.030089 IP 192.168.10.158.40908 > 125.209.222.142.https: Flags [.], ack 33340, win 777, options [nop,nop,TS val 1182997 ecr 4282318137], length 0
17:02:29.030565 IP 182.162.92.209.https > 192.168.10.158.38158: Flags [P.], seq 1449:3652, ack 202, win 122, options [nop,nop,TS val 2121337321 ecr 1182994], length 2203
17:02:29.030581 IP 192.168.10.158.38158 > 182.162.92.209.https: Flags [.], ack 3652, win 286, options [nop,nop,TS val 1182997 ecr 2121337321], length 0
17:02:29.030599 IP 182.162.92.205.https > 192.168.10.158.60284: Flags [P.], seq 1:3651, ack 204, win 122, options [nop,nop,TS val 2117548532 ecr 1182994], length 3650
17:02:29.030608 IP 192.168.10.158.60284 > 182.162.92.205.https: Flags [.], ack 3651, win 286, options [nop,nop,TS val 1182997 ecr 2117548532], length 0
17:02:29.030618 IP 182.162.92.209.https > 192.168.10.158.38160: Flags [.], seq 1:2897, ack 202, win 122, options [nop,nop,TS val 2121337322 ecr 1182994], length 2896
17:02:29.030623 IP 192.168.10.158.38160 > 182.162.92.209.https: Flags [.], ack 2897, win 274, options [nop,nop,TS val 1182997 ecr 2121337322], length 0
17:02:29.033190 IP 192.168.10.158.38158 > 182.162.92.209.https: Flags [P.], seq 202:328, ack 3652, win 286, options [nop,nop,TS val 1182997 ecr 2121337321], length 126
17:02:29.034488 IP 192.168.10.158.60284 > 182.162.92.205.https: Flags [P.], seq 204:330, ack 3651, win 286, options [nop,nop,TS val 1182998 ecr 2117548532], length 126
17:02:29.041452 IP 182.162.92.209.https > 192.168.10.158.38160: Flags [P.], seq 2897:3650, ack 202, win 122, options [nop,nop,TS val 2121337322 ecr 1182994], length 753
17:02:29.041469 IP 192.168.10.158.38160 > 182.162.92.209.https: Flags [.], ack 3650, win 296, options [nop,nop,TS val 1182999 ecr 2121337322], length 0
17:02:29.041490 IP 182.162.92.209.https > 192.168.10.158.38156: Flags [P.], seq 3652:3894, ack 328, win 122, options [nop,nop,TS val 2121337333 ecr 1182996], length 242
17:02:29.041500 IP 182.162.92.209.https > 192.168.10.158.38156: Flags [P.], seq 3894:3963, ack 328, win 122, options [nop,nop,TS val 2121337334 ecr 1182996], length 69
17:02:29.043614 IP 192.168.10.158.38160 > 182.162.92.209.https: Flags [P.], seq 202:328, ack 3650, win 296, options [nop,nop,TS val 1183000 ecr 2121337322], length 126
17:02:29.053711 IP 182.162.92.205.https > 192.168.10.158.60284: Flags [P.], seq 3651:3893, ack 330, win 122, options [nop,nop,TS val 2117548557 ecr 1182998], length 242
17:02:29.054376 IP 182.162.92.205.https > 192.168.10.158.60284: Flags [P.], seq 3893:3962, ack 330, win 122, options [nop,nop,TS val 2117548557 ecr 1182998], length 69
17:02:29.054388 IP 182.162.92.209.https > 192.168.10.158.38158: Flags [P.], seq 3652:3894, ack 328, win 122, options [nop,nop,TS val 2121337347 ecr 1182997], length 242
17:02:29.054397 IP 182.162.92.209.https > 192.168.10.158.38158: Flags [P.], seq 3894:3963, ack 328, win 122, options [nop,nop,TS val 2121337348 ecr 1182997], length 69
17:02:29.054402 IP 182.162.92.209.https > 192.168.10.158.38160: Flags [P.], seq 3650:3892, ack 328, win 122, options [nop,nop,TS val 2121337348 ecr 1183000], length 242
17:02:29.054927 IP 182.162.92.209.https > 192.168.10.158.38160: Flags [P.], seq 3892:3961, ack 328, win 122, options [nop,nop,TS val 2121337348 ecr 1183000], length 69
17:02:29.066143 IP 192.168.10.158.38158 > 182.162.92.209.https: Flags [R.], seq 328, ack 3963, win 308, options [nop,nop,TS val 1183006 ecr 2121337347], length 0
17:02:29.066372 IP 192.168.10.158.38160 > 182.162.92.209.https: Flags [R.], seq 328, ack 3961, win 319, options [nop,nop,TS val 1183006 ecr 2121337348], length 0
17:02:29.066463 IP 192.168.10.158.38156 > 182.162.92.209.https: Flags [P.], seq 328:381, ack 3963, win 308, options [nop,nop,TS val 1183006 ecr 2121337333], length 53
17:02:29.068483 IP 192.168.10.158.60284 > 182.162.92.205.https: Flags [P.], seq 330:383, ack 3962, win 308, options [nop,nop,TS val 1183006 ecr 2117548557], length 53
17:02:29.070608 IP 192.168.10.158.38156 > 182.162.92.209.https: Flags [P.], seq 381:919, ack 3963, win 308, options [nop,nop,TS val 1183007 ecr 2121337333], length 538
17:02:29.070991 IP 192.168.10.158.60284 > 182.162.92.205.https: Flags [P.], seq 383:775, ack 3962, win 308, options [nop,nop,TS val 1183007 ecr 2117548557], length 392
17:02:29.077117 IP 182.162.92.205.https > 192.168.10.158.60284: Flags [.], ack 775, win 130, options [nop,nop,TS val 2117548581 ecr 1183006], length 0
17:02:29.077737 IP 182.162.92.209.https > 192.168.10.158.38156: Flags [.], ack 919, win 130, options [nop,nop,TS val 2121337371 ecr 1183006], length 0
17:02:29.077775 IP 182.162.92.209.https > 192.168.10.158.38156: Flags [P.], seq 3963:4001, ack 919, win 130, options [nop,nop,TS val 2121337371 ecr 1183006], length 38
17:02:29.078642 IP 182.162.92.205.https > 192.168.10.158.60284: Flags [P.], seq 3962:4000, ack 775, win 130, options [nop,nop,TS val 2117548581 ecr 1183006], length 38
17:02:29.078711 IP 182.162.92.209.https > 192.168.10.158.38156: Flags [.], seq 4001:6897, ack 919, win 130, options [nop,nop,TS val 2121337372 ecr 1183006], length 2896
17:02:29.078734 IP 192.168.10.158.38156 > 182.162.92.209.https: Flags [.], ack 6897, win 354, options [nop,nop,TS val 1183009 ecr 2121337371], length 0
17:02:29.079912 IP 182.162.92.209.https > 192.168.10.158.38156: Flags [.], seq 6897:8345, ack 919, win 130, options [nop,nop,TS val 2121337372 ecr 1183006], length 1448
17:02:29.081147 IP 182.162.92.205.https > 192.168.10.158.60284: Flags [P.], seq 4000:7932, ack 775, win 130, options [nop,nop,TS val 2117548582 ecr 1183006], length 3932
17:02:29.081162 IP 192.168.10.158.60284 > 182.162.92.205.https: Flags [.], ack 7932, win 370, options [nop,nop,TS val 1183009 ecr 2117548581], length 0
17:02:29.081198 IP 182.162.92.209.https > 192.168.10.158.38156: Flags [.], seq 8345:12689, ack 919, win 130, options [nop,nop,TS val 2121337372 ecr 1183006], length 4344
17:02:29.081205 IP 192.168.10.158.38156 > 182.162.92.209.https: Flags [.], ack 12689, win 444, options [nop,nop,TS val 1183009 ecr 2121337372], length 0
17:02:29.082182 IP 182.162.92.209.https > 192.168.10.158.38156: Flags [.], seq 12689:17033, ack 919, win 130, options [nop,nop,TS val 2121337372 ecr 1183006], length 4344
17:02:29.082206 IP 192.168.10.158.38156 > 182.162.92.209.https: Flags [.], ack 17033, win 512, options [nop,nop,TS val 1183010 ecr 2121337372], length 0
17:02:29.086475 IP 182.162.92.209.https > 192.168.10.158.38156: Flags [.], seq 17033:18481, ack 919, win 130, options [nop,nop,TS val 2121337380 ecr 1183009], length 1448
17:02:29.088363 IP 182.162.92.209.https > 192.168.10.158.38156: Flags [P.], seq 18481:19929, ack 919, win 130, options [nop,nop,TS val 2121337380 ecr 1183009], length 1448
17:02:29.088381 IP 192.168.10.158.38156 > 182.162.92.209.https: Flags [.], ack 19929, win 557, options [nop,nop,TS val 1183011 ecr 2121337380], length 0
17:02:29.088402 IP 182.162.92.209.https > 192.168.10.158.38156: Flags [P.], seq 19929:20414, ack 919, win 130, options [nop,nop,TS val 2121337380 ecr 1183009], length 485
17:02:29.088408 IP 182.162.92.209.https > 192.168.10.158.38156: Flags [.], seq 20414:21862, ack 919, win 130, options [nop,nop,TS val 2121337380 ecr 1183009], length 1448
17:02:29.088411 IP 192.168.10.158.38156 > 182.162.92.209.https: Flags [.], ack 21862, win 602, options [nop,nop,TS val 1183011 ecr 2121337380], length 0
17:02:29.089416 IP 182.162.92.209.https > 192.168.10.158.38156: Flags [.], seq 21862:24758, ack 919, win 130, options [nop,nop,TS val 2121337382 ecr 1183009], length 2896
17:02:29.089431 IP 192.168.10.158.38156 > 182.162.92.209.https: Flags [.], ack 24758, win 648, options [nop,nop,TS val 1183011 ecr 2121337382], length 0
17:02:29.090097 IP 182.162.92.209.https > 192.168.10.158.38156: Flags [.], seq 24758:27654, ack 919, win 130, options [nop,nop,TS val 2121337382 ecr 1183009], length 2896
17:02:29.090177 IP 192.168.10.158.38156 > 182.162.92.209.https: Flags [.], ack 27654, win 693, options [nop,nop,TS val 1183012 ecr 2121337382], length 0
17:02:29.097163 IP 182.162.92.209.https > 192.168.10.158.38156: Flags [.], seq 27654:29102, ack 919, win 130, options [nop,nop,TS val 2121337390 ecr 1183010], length 1448
17:02:29.098036 IP 182.162.92.209.https > 192.168.10.158.38156: Flags [P.], seq 29102:32906, ack 919, win 130, options [nop,nop,TS val 2121337390 ecr 1183010], length 3804
17:02:29.098055 IP 192.168.10.158.38156 > 182.162.92.209.https: Flags [.], ack 32906, win 775, options [nop,nop,TS val 1183013 ecr 2121337390], length 0
17:02:29.100736 IP 192.168.10.158.54476 > 192.168.10.1.domain: 21992+ A? static.nid.naver.com. (38)


17:02:29.104963 IP 192.168.10.1.domain > 192.168.10.158.54476: 21992 2/0/0 A 125.209.226.239, A 202.179.179.108 (70)
17:02:29.105255 IP 192.168.10.158.43004 > 125.209.226.239.https: Flags [S], seq 2178288613, win 29200, options [mss 1460,sackOK,TS val 1183015 ecr 0,nop,wscale 7], length 0
17:02:29.132803 IP 125.209.226.239.https > 192.168.10.158.43004: Flags [S.], seq 2335966732, ack 2178288614, win 14600, options [mss 1440,nop,nop,sackOK,nop,wscale 7], length 0
17:02:29.132841 IP 192.168.10.158.43004 > 125.209.226.239.https: Flags [.], ack 1, win 229, length 0
17:02:29.133695 IP 192.168.10.158.54476 > 192.168.10.1.domain: 5745+ A? lcs.naver.com. (31)


17:02:29.133914 IP 192.168.10.158.43004 > 125.209.226.239.https: Flags [P.], seq 1:209, ack 1, win 229, length 208
17:02:29.134196 IP 192.168.10.158.38156 > 182.162.92.209.https: Flags [P.], seq 919:996, ack 32906, win 775, options [nop,nop,TS val 1183023 ecr 2121337390], length 77
17:02:29.138034 IP 192.168.10.117 > 224.0.0.251: igmp v2 report 224.0.0.251
17:02:29.138095 IP 192.168.10.158.38156 > 182.162.92.209.https: Flags [P.], seq 996:1482, ack 32906, win 775, options [nop,nop,TS val 1183024 ecr 2121337390], length 486


17:02:29.158299 IP 192.168.10.1.domain > 192.168.10.158.54476: 5745 5/0/0 CNAME lcs.naver.com.akadns.net., CNAME kr-lcs.naver.com.akadns.net., A 202.131.27.102, A 125.209.230.238, A 175.158.0.135 (138)
17:02:29.158588 IP 192.168.10.158.55472 > 202.131.27.102.https: Flags [S], seq 378729833, win 29200, options [mss 1460,sackOK,TS val 1183029 ecr 0,nop,wscale 7], length 0
17:02:29.159336 IP 125.209.226.239.https > 192.168.10.158.43004: Flags [.], ack 209, win 123, length 0
17:02:29.159351 IP 182.162.92.209.https > 192.168.10.158.38156: Flags [.], seq 32906:40146, ack 996, win 130, options [nop,nop,TS val 2121337440 ecr 1183023], length 7240
17:02:29.159364 IP 192.168.10.158.38156 > 182.162.92.209.https: Flags [.], ack 40146, win 888, options [nop,nop,TS val 1183029 ecr 2121337440], length 0
17:02:29.164770 IP 182.162.92.209.https > 192.168.10.158.38156: Flags [P.], seq 40146:49319, ack 996, win 130, options [nop,nop,TS val 2121337440 ecr 1183023], length 9173
17:02:29.164789 IP 192.168.10.158.38156 > 182.162.92.209.https: Flags [.], ack 49319, win 1031, options [nop,nop,TS val 1183030 ecr 2121337440], length 0
17:02:29.164803 IP 182.162.92.209.https > 192.168.10.158.38156: Flags [P.], seq 49319:50259, ack 996, win 130, options [nop,nop,TS val 2121337440 ecr 1183023], length 940
17:02:29.164816 IP 125.209.226.239.https > 192.168.10.158.43004: Flags [P.], seq 1:6111, ack 209, win 123, length 6110
17:02:29.164821 IP 192.168.10.158.43004 > 125.209.226.239.https: Flags [.], ack 6111, win 324, length 0
17:02:29.164826 IP 182.162.92.209.https > 192.168.10.158.38156: Flags [.], seq 50259:53155, ack 996, win 130, options [nop,nop,TS val 2121337440 ecr 1183023], length 2896
17:02:29.164829 IP 192.168.10.158.38156 > 182.162.92.209.https: Flags [.], ack 53155, win 1099, options [nop,nop,TS val 1183030 ecr 2121337440], length 0
17:02:29.166473 IP 192.168.10.158.43004 > 125.209.226.239.https: Flags [P.], seq 209:335, ack 6111, win 324, length 126
17:02:29.173500 IP 192.168.10.158.43004 > 125.209.226.239.https: Flags [P.], seq 335:720, ack 6111, win 324, length 385
17:02:29.179402 IP 182.162.92.209.https > 192.168.10.158.38156: Flags [.], seq 53155:54603, ack 1482, win 139, options [nop,nop,TS val 2121337473 ecr 1183024], length 1448
17:02:29.180552 IP 182.162.92.209.https > 192.168.10.158.38156: Flags [.], seq 54603:61843, ack 1482, win 139, options [nop,nop,TS val 2121337473 ecr 1183024], length 7240
17:02:29.180567 IP 192.168.10.158.38156 > 182.162.92.209.https: Flags [.], ack 61843, win 1235, options [nop,nop,TS val 1183034 ecr 2121337473], length 0
17:02:29.181796 IP 182.162.92.209.https > 192.168.10.158.38156: Flags [.], seq 61843:71979, ack 1482, win 139, options [nop,nop,TS val 2121337473 ecr 1183030], length 10136
17:02:29.181802 IP 192.168.10.158.38156 > 182.162.92.209.https: Flags [.], ack 71979, win 1340, options [nop,nop,TS val 1183034 ecr 2121337473], length 0
17:02:29.182534 IP 182.162.92.209.https > 192.168.10.158.38156: Flags [P.], seq 71979:73427, ack 1482, win 139, options [nop,nop,TS val 2121337473 ecr 1183030], length 1448
17:02:29.182544 IP 202.131.27.102.https > 192.168.10.158.55472: Flags [S.], seq 2349121052, ack 378729834, win 5840, options [mss 1440,nop,nop,sackOK,nop,wscale 7], length 0
17:02:29.182556 IP 192.168.10.158.55472 > 202.131.27.102.https: Flags [.], ack 1, win 229, length 0
17:02:29.182567 IP 125.209.226.239.https > 192.168.10.158.43004: Flags [P.], seq 6111:6369, ack 335, win 123, length 258
17:02:29.182572 IP 182.162.92.209.https > 192.168.10.158.38156: Flags [.], seq 73427:79219, ack 1482, win 139, options [nop,nop,TS val 2121337473 ecr 1183030], length 5792
17:02:29.182575 IP 192.168.10.158.38156 > 182.162.92.209.https: Flags [.], ack 79219, win 1388, options [nop,nop,TS val 1183035 ecr 2121337473], length 0
17:02:29.182687 IP 192.168.10.158.55472 > 202.131.27.102.https: Flags [P.], seq 1:202, ack 1, win 229, length 201
17:02:29.186703 IP 125.209.226.239.https > 192.168.10.158.43004: Flags [.], seq 6369:7829, ack 720, win 131, length 1460
17:02:29.186715 IP 192.168.10.158.43004 > 125.209.226.239.https: Flags [.], ack 7829, win 370, length 0
17:02:29.187925 IP 125.209.226.239.https > 192.168.10.158.43004: Flags [.], seq 7829:12209, ack 720, win 131, length 4380
17:02:29.187933 IP 192.168.10.158.43004 > 125.209.226.239.https: Flags [.], ack 12209, win 438, length 0
17:02:29.189117 IP 125.209.226.239.https > 192.168.10.158.43004: Flags [.], seq 12209:13669, ack 720, win 131, length 1460
17:02:29.190357 IP 125.209.226.239.https > 192.168.10.158.43004: Flags [.], seq 13669:19509, ack 720, win 131, length 5840
17:02:29.190366 IP 192.168.10.158.43004 > 125.209.226.239.https: Flags [.], ack 19509, win 552, length 0
17:02:29.190376 IP 182.162.92.209.https > 192.168.10.158.38156: Flags [.], seq 79219:83563, ack 1482, win 139, options [nop,nop,TS val 2121337483 ecr 1183034], length 4344
17:02:29.190378 IP 192.168.10.158.38156 > 182.162.92.209.https: Flags [.], ack 83563, win 1404, options [nop,nop,TS val 1183037 ecr 2121337483], length 0
17:02:29.192364 IP 182.162.92.209.https > 192.168.10.158.38156: Flags [.], seq 83563:86459, ack 1482, win 139, options [nop,nop,TS val 2121337483 ecr 1183034], length 2896
17:02:29.192376 IP 192.168.10.158.38156 > 182.162.92.209.https: Flags [.], ack 86459, win 1420, options [nop,nop,TS val 1183037 ecr 2121337483], length 0
17:02:29.193154 IP 182.162.92.209.https > 192.168.10.158.38156: Flags [.], seq 86459:89355, ack 1482, win 139, options [nop,nop,TS val 2121337483 ecr 1183034], length 2896
17:02:29.193163 IP 192.168.10.158.38156 > 182.162.92.209.https: Flags [.], ack 89355, win 1420, options [nop,nop,TS val 1183037 ecr 2121337483], length 0
17:02:29.194081 IP 182.162.92.209.https > 192.168.10.158.38156: Flags [P.], seq 89355:90803, ack 1482, win 139, options [nop,nop,TS val 2121337483 ecr 1183034], length 1448
17:02:29.194096 IP 182.162.92.209.https > 192.168.10.158.38156: Flags [.], seq 90803:92251, ack 1482, win 139, options [nop,nop,TS val 2121337483 ecr 1183034], length 1448
17:02:29.194102 IP 192.168.10.158.38156 > 182.162.92.209.https: Flags [.], ack 92251, win 1420, options [nop,nop,TS val 1183038 ecr 2121337483], length 0
17:02:29.194510 IP 182.162.92.209.https > 192.168.10.158.38156: Flags [.], seq 92251:93699, ack 1482, win 139, options [nop,nop,TS val 2121337483 ecr 1183034], length 1448
17:02:29.196612 IP 182.162.92.209.https > 192.168.10.158.38156: Flags [.], seq 93699:98043, ack 1482, win 139, options [nop,nop,TS val 2121337483 ecr 1183034], length 4344
17:02:29.196641 IP 192.168.10.158.38156 > 182.162.92.209.https: Flags [.], ack 98043, win 1444, options [nop,nop,TS val 1183038 ecr 2121337483], length 0
17:02:29.197157 IP 182.162.92.209.https > 192.168.10.158.38156: Flags [.], seq 98043:99491, ack 1482, win 139, options [nop,nop,TS val 2121337483 ecr 1183034], length 1448
17:02:29.197183 IP 182.162.92.209.https > 192.168.10.158.38156: Flags [.], seq 99491:100939, ack 1482, win 139, options [nop,nop,TS val 2121337483 ecr 1183035], length 1448
17:02:29.197220 IP 192.168.10.158.38156 > 182.162.92.209.https: Flags [.], ack 100939, win 1444, options [nop,nop,TS val 1183038 ecr 2121337483], length 0
17:02:29.199225 IP 192.168.10.158.38156 > 182.162.92.209.https: Flags [P.], seq 1482:1573, ack 100939, win 1444, options [nop,nop,TS val 1183039 ecr 2121337483], length 91
17:02:29.199380 IP 202.131.27.102.https > 192.168.10.158.55472: Flags [.], ack 202, win 54, length 0
17:02:29.199413 IP 202.131.27.102.https > 192.168.10.158.55472: Flags [P.], seq 1:3518, ack 202, win 54, length 3517
17:02:29.199435 IP 192.168.10.158.55472 > 202.131.27.102.https: Flags [.], ack 3518, win 284, length 0
17:02:29.199450 IP 182.162.92.209.https > 192.168.10.158.38156: Flags [.], seq 100939:108179, ack 1482, win 139, options [nop,nop,TS val 2121337483 ecr 1183035], length 7240
17:02:29.200388 IP 192.168.10.158.55472 > 202.131.27.102.https: Flags [P.], seq 202:352, ack 3518, win 284, length 150
17:02:29.200423 IP 192.168.10.158.38156 > 182.162.92.209.https: Flags [.], ack 108179, win 1444, options [nop,nop,TS val 1183039 ecr 2121337483], length 0
17:02:29.200652 IP 125.209.226.239.https > 192.168.10.158.43004: Flags [P.], seq 19509:22608, ack 720, win 131, length 3099
17:02:29.200657 IP 192.168.10.158.43004 > 125.209.226.239.https: Flags [.], ack 22608, win 601, length 0
17:02:29.200669 IP 182.162.92.209.https > 192.168.10.158.38156: Flags [.], seq 108179:113971, ack 1482, win 139, options [nop,nop,TS val 2121337491 ecr 1183037], length 5792
17:02:29.201483 IP 192.168.10.158.38156 > 182.162.92.209.https: Flags [.], ack 113971, win 1444, options [nop,nop,TS val 1183039 ecr 2121337491], length 0
17:02:29.201550 IP 182.162.92.209.https > 192.168.10.158.38156: Flags [.], seq 113971:116867, ack 1482, win 139, options [nop,nop,TS val 2121337492 ecr 1183037], length 2896
17:02:29.201562 IP 182.162.92.209.https > 192.168.10.158.38156: Flags [.], seq 116867:119763, ack 1482, win 139, options [nop,nop,TS val 2121337492 ecr 1183037], length 2896
17:02:29.201633 IP 192.168.10.158.38156 > 182.162.92.209.https: Flags [.], ack 119763, win 1444, options [nop,nop,TS val 1183039 ecr 2121337492], length 0
17:02:29.203501 IP 182.162.92.209.https > 192.168.10.158.38156: Flags [.], seq 119763:122659, ack 1482, win 139, options [nop,nop,TS val 2121337493 ecr 1183037], length 2896
17:02:29.203508 IP 182.162.92.209.https > 192.168.10.158.38156: Flags [P.], seq 122659:125555, ack 1482, win 139, options [nop,nop,TS val 2121337495 ecr 1183038], length 2896
17:02:29.203513 IP 182.162.92.209.https > 192.168.10.158.38156: Flags [.], seq 125555:128451, ack 1482, win 139, options [nop,nop,TS val 2121337495 ecr 1183038], length 2896
17:02:29.203517 IP 192.168.10.158.38156 > 182.162.92.209.https: Flags [.], ack 125555, win 1444, options [nop,nop,TS val 1183040 ecr 2121337493], length 0
17:02:29.203529 IP 192.168.10.158.38156 > 182.162.92.209.https: Flags [.], ack 128451, win 1444, options [nop,nop,TS val 1183040 ecr 2121337495], length 0
17:02:29.204646 IP 182.162.92.209.https > 192.168.10.158.38156: Flags [.], seq 128451:131347, ack 1482, win 139, options [nop,nop,TS val 2121337497 ecr 1183038], length 2896
17:02:29.204659 IP 192.168.10.158.38156 > 182.162.92.209.https: Flags [.], ack 131347, win 1444, options [nop,nop,TS val 1183040 ecr 2121337497], length 0
17:02:29.205444 IP 182.162.92.209.https > 192.168.10.158.38156: Flags [.], seq 131347:134243, ack 1482, win 139, options [nop,nop,TS val 2121337497 ecr 1183038], length 2896
17:02:29.205453 IP 192.168.10.158.38156 > 182.162.92.209.https: Flags [.], ack 134243, win 1444, options [nop,nop,TS val 1183040 ecr 2121337497], length 0
17:02:29.205975 IP 192.168.10.158.38156 > 182.162.92.209.https: Flags [P.], seq 1573:1665, ack 134243, win 1444, options [nop,nop,TS val 1183040 ecr 2121337497], length 92
17:02:29.206254 IP 182.162.92.209.https > 192.168.10.158.38156: Flags [.], seq 134243:137139, ack 1482, win 139, options [nop,nop,TS val 2121337498 ecr 1183038], length 2896
17:02:29.206266 IP 192.168.10.158.38156 > 182.162.92.209.https: Flags [.], ack 137139, win 1444, options [nop,nop,TS val 1183041 ecr 2121337498], length 0
17:02:29.212704 IP 202.131.27.102.https > 192.168.10.158.55472: Flags [P.], seq 3518:3784, ack 352, win 63, length 266
17:02:29.212747 IP 182.162.92.209.https > 192.168.10.158.38156: Flags [.], seq 137139:148723, ack 1573, win 139, options [nop,nop,TS val 2121337502 ecr 1183039], length 11584
17:02:29.212770 IP 182.162.92.209.https > 192.168.10.158.38156: Flags [P.], seq 148723:151619, ack 1573, win 139, options [nop,nop,TS val 2121337503 ecr 1183039], length 2896
17:02:29.212782 IP 182.162.92.209.https > 192.168.10.158.38156: Flags [.], seq 151619:154515, ack 1573, win 139, options [nop,nop,TS val 2121337503 ecr 1183039], length 2896
17:02:29.213389 IP 192.168.10.158.54476 > 192.168.10.1.domain: 3299+ PTR? 1.10.168.192.in-addr.arpa. (43)
17:02:29.213922 IP 182.162.92.209.https > 192.168.10.158.38156: Flags [.], seq 154515:167547, ack 1573, win 139, options [nop,nop,TS val 2121337504 ecr 1183040], length 13032
17:02:29.214359 IP 192.168.10.158.38156 > 182.162.92.209.https: Flags [.], ack 167547, win 1308, options [nop,nop,TS val 1183043 ecr 2121337502], length 0
17:02:29.214964 IP 182.162.92.209.https > 192.168.10.158.38156: Flags [.], seq 167547:168995, ack 1573, win 139, options [nop,nop,TS val 2121337504 ecr 1183040], length 1448
17:02:29.214975 IP 182.162.92.209.https > 192.168.10.158.38156: Flags [.], seq 168995:171891, ack 1573, win 139, options [nop,nop,TS val 2121337506 ecr 1183040], length 2896
17:02:29.214980 IP 192.168.10.158.38156 > 182.162.92.209.https: Flags [.], ack 171891, win 1404, options [nop,nop,TS val 1183043 ecr 2121337504], length 0
17:02:29.214991 IP 182.162.92.209.https > 192.168.10.158.38156: Flags [.], seq 171891:174787, ack 1665, win 139, options [nop,nop,TS val 2121337506 ecr 1183040], length 2896
17:02:29.215274 IP 192.168.10.158.38156 > 182.162.92.209.https: Flags [.], ack 174787, win 1444, options [nop,nop,TS val 1183043 ecr 2121337506], length 0
17:02:29.215530 IP 192.168.10.158.38156 > 182.162.92.209.https: Flags [P.], seq 1665:1757, ack 174787, win 1444, options [nop,nop,TS val 1183043 ecr 2121337506], length 92
17:02:29.216530 IP 192.168.10.158.38156 > 182.162.92.209.https: Flags [P.], seq 1757:1848, ack 174787, win 1444, options [nop,nop,TS val 1183043 ecr 2121337506], length 91
17:02:29.216882 IP 192.168.10.158.55472 > 202.131.27.102.https: Flags [P.], seq 352:997, ack 3784, win 306, length 645
17:02:29.217308 IP 192.168.10.1.domain > 192.168.10.158.54476: 3299 NXDomain 0/1/0 (78)
17:02:29.217470 IP 192.168.10.158.54476 > 192.168.10.1.domain: 17107+ PTR? 158.10.168.192.in-addr.arpa. (45)
17:02:29.222820 IP 182.162.92.209.https > 192.168.10.158.38156: Flags [.], seq 174787:176235, ack 1665, win 139, options [nop,nop,TS val 2121337515 ecr 1183043], length 1448
17:02:29.223714 IP 182.162.92.209.https > 192.168.10.158.38156: Flags [P.], seq 176235:180579, ack 1665, win 139, options [nop,nop,TS val 2121337515 ecr 1183043], length 4344
17:02:29.223745 IP 182.162.92.209.https > 192.168.10.158.38156: Flags [.], seq 180579:186371, ack 1665, win 139, options [nop,nop,TS val 2121337515 ecr 1183043], length 5792
17:02:29.223766 IP 192.168.10.158.38156 > 182.162.92.209.https: Flags [.], ack 180579, win 1444, options [nop,nop,TS val 1183045 ecr 2121337515], length 0
17:02:29.223820 IP 192.168.10.158.38156 > 182.162.92.209.https: Flags [.], ack 186371, win 1444, options [nop,nop,TS val 1183045 ecr 2121337515], length 0
17:02:29.224451 IP 192.168.10.158.38156 > 182.162.92.209.https: Flags [P.], seq 1848:1940, ack 186371, win 1444, options [nop,nop,TS val 1183045 ecr 2121337515], length 92
17:02:29.227649 IP 192.168.10.1.domain > 192.168.10.158.54476: 17107 NXDomain 0/1/0 (80)
17:02:29.227673 IP 182.162.92.209.https > 192.168.10.158.38156: Flags [.], seq 186371:209539, ack 1665, win 139, options [nop,nop,TS val 2121337515 ecr 1183043], length 23168
17:02:29.227681 IP 182.162.92.209.https > 192.168.10.158.38156: Flags [.], seq 209539:212435, ack 1665, win 139, options [nop,nop,TS val 2121337516 ecr 1183043], length 2896
17:02:29.227683 IP 182.162.92.209.https > 192.168.10.158.38156: Flags [.], ack 1848, win 139, options [nop,nop,TS val 2121337517 ecr 1183043], length 0
17:02:29.227687 IP 202.131.27.102.https > 192.168.10.158.55472: Flags [P.], seq 3784:4333, ack 997, win 73, length 549
17:02:29.227699 IP 192.168.10.158.38156 > 182.162.92.209.https: Flags [.], ack 212435, win 1241, options [nop,nop,TS val 1183046 ecr 2121337515], length 0
17:02:29.227838 IP 192.168.10.158.54476 > 192.168.10.1.domain: 7137+ PTR? 142.222.209.125.in-addr.arpa. (46)
17:02:29.228401 IP 192.168.10.158.55472 > 202.131.27.102.https: Flags [F.], seq 997, ack 4333, win 329, length 0
17:02:29.228693 IP 202.131.27.102.https > 192.168.10.158.55472: Flags [FP.], seq 4333:4386, ack 997, win 73, length 53
17:02:29.228706 IP 192.168.10.158.55472 > 202.131.27.102.https: Flags [R], seq 378730830, win 0, length 0
17:02:29.228715 IP 182.162.92.209.https > 192.168.10.158.38156: Flags [.], seq 212435:213883, ack 1848, win 139, options [nop,nop,TS val 2121337518 ecr 1183043], length 1448
17:02:29.228716 IP 192.168.10.158.38156 > 182.162.92.209.https: Flags [P.], seq 1940:2031, ack 212435, win 1444, options [nop,nop,TS val 1183046 ecr 2121337515], length 91
17:02:29.229928 IP 192.168.10.158.38156 > 182.162.92.209.https: Flags [P.], seq 2031:2122, ack 213883, win 1444, options [nop,nop,TS val 1183046 ecr 2121337518], length 91
17:02:29.231876 IP 182.162.92.209.https > 192.168.10.158.38156: Flags [.], seq 213883:215331, ack 1848, win 139, options [nop,nop,TS val 2121337524 ecr 1183045], length 1448
17:02:29.232474 IP 182.162.92.209.https > 192.168.10.158.38156: Flags [.], seq 215331:218227, ack 1848, win 139, options [nop,nop,TS val 2121337524 ecr 1183045], length 2896
17:02:29.232489 IP 192.168.10.158.38156 > 182.162.92.209.https: Flags [.], ack 218227, win 1444, options [nop,nop,TS val 1183047 ecr 2121337524], length 0
17:02:29.233971 IP 192.168.10.158.38156 > 182.162.92.209.https: Flags [P.], seq 2122:2242, ack 218227, win 1444, options [nop,nop,TS val 1183047 ecr 2121337524], length 120
17:02:29.234025 IP 182.162.92.209.https > 192.168.10.158.38156: Flags [.], seq 218227:219675, ack 1848, win 139, options [nop,nop,TS val 2121337525 ecr 1183045], length 1448
17:02:29.237338 IP 192.168.10.158.54476 > 192.168.10.1.domain: 18995+ A? nv.veta.naver.com. (35)
17:02:29.238539 IP 182.162.92.209.https > 192.168.10.158.38156: Flags [.], seq 219675:224019, ack 1848, win 139, options [nop,nop,TS val 2121337525 ecr 1183045], length 4344
17:02:29.238667 IP 192.168.10.158.38156 > 182.162.92.209.https: Flags [.], ack 224019, win 1444, options [nop,nop,TS val 1183049 ecr 2121337525], length 0
17:02:29.239908 IP 192.168.10.1.domain > 192.168.10.158.54476: 7137 NXDomain 0/1/0 (105)
17:02:29.239926 IP 182.162.92.209.https > 192.168.10.158.38156: Flags [.], seq 224019:225467, ack 1940, win 139, options [nop,nop,TS val 2121337528 ecr 1183045], length 1448
17:02:29.240344 IP 192.168.10.158.54476 > 192.168.10.1.domain: 14688+ PTR? 209.92.162.182.in-addr.arpa. (45)
17:02:29.240412 IP 182.162.92.209.https > 192.168.10.158.38156: Flags [.], seq 225467:228363, ack 1940, win 139, options [nop,nop,TS val 2121337528 ecr 1183045], length 2896
17:02:29.240430 IP 192.168.10.158.38156 > 182.162.92.209.https: Flags [.], ack 228363, win 1444, options [nop,nop,TS val 1183049 ecr 2121337528], length 0
17:02:29.242300 IP 182.162.92.209.https > 192.168.10.158.38156: Flags [.], seq 228363:248635, ack 1940, win 139, options [nop,nop,TS val 2121337528 ecr 1183045], length 20272
17:02:29.242597 IP 192.168.10.158.38156 > 182.162.92.209.https: Flags [.], ack 248635, win 1286, options [nop,nop,TS val 1183050 ecr 2121337528], length 0
17:02:29.243540 IP 192.168.10.158.38156 > 182.162.92.209.https: Flags [P.], seq 2242:2333, ack 248635, win 1444, options [nop,nop,TS val 1183050 ecr 2121337528], length 91
17:02:29.244846 IP 182.162.92.209.https > 192.168.10.158.38156: Flags [.], seq 248635:250083, ack 1940, win 139, options [nop,nop,TS val 2121337528 ecr 1183045], length 1448
17:02:29.244859 IP 182.162.92.209.https > 192.168.10.158.38156: Flags [.], seq 250083:251531, ack 2031, win 139, options [nop,nop,TS val 2121337530 ecr 1183046], length 1448
17:02:29.244866 IP 182.162.92.209.https > 192.168.10.158.38156: Flags [.], seq 251531:252979, ack 2122, win 139, options [nop,nop,TS val 2121337530 ecr 1183046], length 1448
17:02:29.244876 IP 192.168.10.158.38156 > 182.162.92.209.https: Flags [.], ack 252979, win 1444, options [nop,nop,TS val 1183050 ecr 2121337528], length 0
17:02:29.245708 IP 192.168.10.1.domain > 192.168.10.158.54476: 18995 3/0/0 CNAME nv.veta.naver.com.nheos.com., A 111.91.134.203, A 103.6.174.17 (105)
17:02:29.246417 IP 202.131.27.102.https > 192.168.10.158.55472: Flags [.], ack 998, win 73, length 0
17:02:29.246432 IP 192.168.10.158.55472 > 202.131.27.102.https: Flags [R], seq 378730831, win 0, length 0
17:02:29.246450 IP 182.162.92.209.https > 192.168.10.158.38156: Flags [.], seq 252979:257323, ack 2122, win 139, options [nop,nop,TS val 2121337533 ecr 1183047], length 4344
17:02:29.246548 IP 192.168.10.158.38156 > 182.162.92.209.https: Flags [.], ack 257323, win 1444, options [nop,nop,TS val 1183051 ecr 2121337533], length 0
17:02:29.247448 IP 192.168.10.158.48906 > 111.91.134.203.https: Flags [S], seq 3170442524, win 29200, options [mss 1460,sackOK,TS val 1183051 ecr 0,nop,wscale 7], length 0
17:02:29.248904 IP 192.168.10.158.38170 > 182.162.92.209.https: Flags [S], seq 487070390, win 29200, options [mss 1460,sackOK,TS val 1183051 ecr 0,nop,wscale 7], length 0
17:02:29.249258 IP 192.168.10.158.38156 > 182.162.92.209.https: Flags [P.], seq 2333:2424, ack 257323, win 1444, options [nop,nop,TS val 1183051 ecr 2121337533], length 91
17:02:29.249911 IP 192.168.10.158.48910 > 111.91.134.203.https: Flags [S], seq 3278789487, win 29200, options [mss 1460,sackOK,TS val 1183051 ecr 0,nop,wscale 7], length 0
17:02:29.251644 IP 182.162.92.209.https > 192.168.10.158.38156: Flags [.], seq 257323:258771, ack 2122, win 139, options [nop,nop,TS val 2121337533 ecr 1183047], length 1448
17:02:29.252317 IP 192.168.10.1.domain > 192.168.10.158.54476: 14688 NXDomain 0/1/0 (104)
17:02:29.252333 IP 182.162.92.209.https > 192.168.10.158.38156: Flags [.], seq 258771:264563, ack 2242, win 139, options [nop,nop,TS val 2121337539 ecr 1183047], length 5792
17:02:29.252342 IP 182.162.92.209.https > 192.168.10.158.38156: Flags [.], seq 264563:267459, ack 2242, win 139, options [nop,nop,TS val 2121337541 ecr 1183049], length 2896
17:02:29.252400 IP 192.168.10.158.38156 > 182.162.92.209.https: Flags [.], ack 267459, win 1444, options [nop,nop,TS val 1183052 ecr 2121337533], length 0
17:02:29.252554 IP 192.168.10.158.54476 > 192.168.10.1.domain: 33173+ PTR? 205.92.162.182.in-addr.arpa. (45)
17:02:29.253106 IP 182.162.92.209.https > 192.168.10.158.38156: Flags [.], seq 267459:277595, ack 2242, win 139, options [nop,nop,TS val 2121337543 ecr 1183050], length 10136
17:02:29.253151 IP 192.168.10.158.38156 > 182.162.92.209.https: Flags [.], ack 277595, win 1444, options [nop,nop,TS val 1183052 ecr 2121337543], length 0
17:02:29.253750 IP 182.162.92.209.https > 192.168.10.158.38156: Flags [.], seq 277595:283387, ack 2242, win 139, options [nop,nop,TS val 2121337543 ecr 1183050], length 5792
17:02:29.253798 IP 192.168.10.158.38156 > 182.162.92.209.https: Flags [.], ack 283387, win 1444, options [nop,nop,TS val 1183052 ecr 2121337543], length 0
17:02:29.255972 IP 182.162.92.209.https > 192.168.10.158.38156: Flags [.], seq 283387:287731, ack 2242, win 139, options [nop,nop,TS val 2121337543 ecr 1183050], length 4344
17:02:29.255982 IP 182.162.92.209.https > 192.168.10.158.38156: Flags [.], seq 287731:293523, ack 2333, win 139, options [nop,nop,TS val 2121337545 ecr 1183050], length 5792
17:02:29.255997 IP 192.168.10.158.38156 > 182.162.92.209.https: Flags [.], ack 293523, win 1444, options [nop,nop,TS val 1183053 ecr 2121337543], length 0
17:02:29.256718 IP 192.168.10.158.38156 > 182.162.92.209.https: Flags [P.], seq 2424:2515, ack 293523, win 1444, options [nop,nop,TS val 1183053 ecr 2121337543], length 91
17:02:29.256744 IP 182.162.92.209.https > 192.168.10.158.38156: Flags [.], seq 293523:297867, ack 2333, win 139, options [nop,nop,TS val 2121337547 ecr 1183051], length 4344
17:02:29.257109 IP 192.168.10.158.38156 > 182.162.92.209.https: Flags [.], ack 297867, win 1444, options [nop,nop,TS val 1183053 ecr 2121337547], length 0
17:02:29.258523 IP 111.91.134.203.https > 192.168.10.158.48906: Flags [S.], seq 1152666020, ack 3170442525, win 14480, options [mss 1440,sackOK,TS val 768179457 ecr 1183051,nop,wscale 7], length 0
17:02:29.258544 IP 192.168.10.158.48906 > 111.91.134.203.https: Flags [.], ack 1, win 229, options [nop,nop,TS val 1183054 ecr 768179457], length 0
17:02:29.258551 IP 182.162.92.209.https > 192.168.10.158.38170: Flags [S.], seq 1786754589, ack 487070391, win 14480, options [mss 1460,sackOK,TS val 2121337551 ecr 1183051,nop,wscale 7], length 0
17:02:29.258555 IP 192.168.10.158.38170 > 182.162.92.209.https: Flags [.], ack 1, win 229, options [nop,nop,TS val 1183054 ecr 2121337551], length 0
17:02:29.258557 IP 111.91.134.203.https > 192.168.10.158.48910: Flags [S.], seq 3142571938, ack 3278789488, win 14480, options [mss 1440,sackOK,TS val 3820992067 ecr 1183051,nop,wscale 7], length 0
17:02:29.258560 IP 192.168.10.158.48910 > 111.91.134.203.https: Flags [.], ack 1, win 229, options [nop,nop,TS val 1183054 ecr 3820992067], length 0
17:02:29.258561 IP 182.162.92.209.https > 192.168.10.158.38156: Flags [.], seq 297867:299315, ack 2333, win 139, options [nop,nop,TS val 2121337547 ecr 1183051], length 1448
17:02:29.258623 IP 192.168.10.158.48906 > 111.91.134.203.https: Flags [P.], seq 1:206, ack 1, win 229, options [nop,nop,TS val 1183054 ecr 768179457], length 205
17:02:29.258698 IP 192.168.10.158.38170 > 182.162.92.209.https: Flags [P.], seq 1:198, ack 1, win 229, options [nop,nop,TS val 1183054 ecr 2121337551], length 197
17:02:29.258751 IP 192.168.10.158.48910 > 111.91.134.203.https: Flags [P.], seq 1:206, ack 1, win 229, options [nop,nop,TS val 1183054 ecr 3820992067], length 205
17:02:29.259743 IP 192.168.10.1.domain > 192.168.10.158.54476: 33173 NXDomain 0/1/0 (104)
17:02:29.260446 IP 192.168.10.158.54476 > 192.168.10.1.domain: 41115+ PTR? 239.226.209.125.in-addr.arpa. (46)
17:02:29.261204 IP 182.162.92.209.https > 192.168.10.158.38156: Flags [.], seq 299315:300763, ack 2424, win 139, options [nop,nop,TS val 2121337554 ecr 1183051], length 1448
17:02:29.261320 IP 192.168.10.158.38156 > 182.162.92.209.https: Flags [.], ack 300763, win 1444, options [nop,nop,TS val 1183054 ecr 2121337547], length 0
17:02:29.262691 IP 182.162.92.209.https > 192.168.10.158.38156: Flags [P.], seq 300763:308003, ack 2424, win 139, options [nop,nop,TS val 2121337554 ecr 1183051], length 7240
17:02:29.262724 IP 192.168.10.158.38156 > 182.162.92.209.https: Flags [.], ack 308003, win 1444, options [nop,nop,TS val 1183055 ecr 2121337554], length 0
17:02:29.263246 IP 192.168.10.158.38156 > 182.162.92.209.https: Flags [P.], seq 2515:2606, ack 308003, win 1444, options [nop,nop,TS val 1183055 ecr 2121337554], length 91
17:02:29.263829 IP 182.162.92.209.https > 192.168.10.158.38156: Flags [.], seq 308003:318139, ack 2424, win 139, options [nop,nop,TS val 2121337555 ecr 1183052], length 10136
17:02:29.263848 IP 192.168.10.158.38156 > 182.162.92.209.https: Flags [.], ack 318139, win 1444, options [nop,nop,TS val 1183055 ecr 2121337555], length 0
17:02:29.267324 IP 182.162.92.209.https > 192.168.10.158.38156: Flags [.], seq 318139:321035, ack 2424, win 139, options [nop,nop,TS val 2121337555 ecr 1183052], length 2896
17:02:29.267343 IP 192.168.10.158.38156 > 182.162.92.209.https: Flags [.], ack 321035, win 1444, options [nop,nop,TS val 1183056 ecr 2121337555], length 0
17:02:29.271232 IP 182.162.92.209.https > 192.168.10.158.38156: Flags [.], seq 321035:325379, ack 2424, win 139, options [nop,nop,TS val 2121337555 ecr 1183052], length 4344
17:02:29.271249 IP 182.162.92.209.https > 192.168.10.158.38156: Flags [.], seq 325379:336963, ack 2424, win 139, options [nop,nop,TS val 2121337557 ecr 1183053], length 11584
17:02:29.271253 IP 192.168.10.1.domain > 192.168.10.158.54476: 41115 NXDomain 0/1/0 (105)
17:02:29.271261 IP 111.91.134.203.https > 192.168.10.158.48906: Flags [.], ack 206, win 122, options [nop,nop,TS val 768179466 ecr 1183054], length 0
17:02:29.271265 IP 192.168.10.158.38156 > 182.162.92.209.https: Flags [.], ack 336963, win 1444, options [nop,nop,TS val 1183057 ecr 2121337555], length 0
17:02:29.271267 IP 111.91.134.203.https > 192.168.10.158.48910: Flags [.], ack 206, win 122, options [nop,nop,TS val 3820992076 ecr 1183054], length 0
17:02:29.271270 IP 182.162.92.209.https > 192.168.10.158.38156: Flags [.], seq 336963:339859, ack 2515, win 139, options [nop,nop,TS val 2121337558 ecr 1183053], length 2896
17:02:29.271445 IP 192.168.10.158.54476 > 192.168.10.1.domain: 22725+ PTR? 251.0.0.224.in-addr.arpa. (42)
17:02:29.271566 IP 182.162.92.209.https > 192.168.10.158.38170: Flags [.], seq 1:2897, ack 198, win 122, options [nop,nop,TS val 2121337560 ecr 1183054], length 2896
17:02:29.271573 IP 192.168.10.158.38170 > 182.162.92.209.https: Flags [.], ack 2897, win 274, options [nop,nop,TS val 1183057 ecr 2121337560], length 0
17:02:29.271775 IP 192.168.10.158.38156 > 182.162.92.209.https: Flags [.], ack 339859, win 1444, options [nop,nop,TS val 1183057 ecr 2121337558], length 0
17:02:29.271971 IP 182.162.92.209.https > 192.168.10.158.38170: Flags [P.], seq 2897:3652, ack 198, win 122, options [nop,nop,TS val 2121337560 ecr 1183054], length 755
17:02:29.271977 IP 192.168.10.158.38170 > 182.162.92.209.https: Flags [.], ack 3652, win 296, options [nop,nop,TS val 1183057 ecr 2121337560], length 0
17:02:29.272796 IP 192.168.10.158.38170 > 182.162.92.209.https: Flags [P.], seq 198:324, ack 3652, win 296, options [nop,nop,TS val 1183057 ecr 2121337560], length 126
17:02:29.273081 IP 192.168.10.158.38156 > 182.162.92.209.https: Flags [P.], seq 2606:2697, ack 339859, win 1444, options [nop,nop,TS val 1183057 ecr 2121337558], length 91
17:02:29.274486 IP 111.91.134.203.https > 192.168.10.158.48906: Flags [.], seq 1:1449, ack 206, win 122, options [nop,nop,TS val 768179468 ecr 1183054], length 1448
17:02:29.274506 IP 192.168.10.158.48906 > 111.91.134.203.https: Flags [.], ack 1449, win 251, options [nop,nop,TS val 1183058 ecr 768179468], length 0
17:02:29.275017 IP 111.91.134.203.https > 192.168.10.158.48906: Flags [P.], seq 1449:4742, ack 206, win 122, options [nop,nop,TS val 768179468 ecr 1183054], length 3293
17:02:29.275025 IP 192.168.10.158.48906 > 111.91.134.203.https: Flags [.], ack 4742, win 303, options [nop,nop,TS val 1183058 ecr 768179468], length 0
17:02:29.275034 IP 111.91.134.203.https > 192.168.10.158.48910: Flags [.], seq 1:1449, ack 206, win 122, options [nop,nop,TS val 3820992077 ecr 1183054], length 1448
17:02:29.275037 IP 192.168.10.158.48910 > 111.91.134.203.https: Flags [.], ack 1449, win 251, options [nop,nop,TS val 1183058 ecr 3820992077], length 0
17:02:29.275341 IP 111.91.134.203.https > 192.168.10.158.48910: Flags [.], seq 1449:4345, ack 206, win 122, options [nop,nop,TS val 3820992077 ecr 1183054], length 2896
17:02:29.275347 IP 192.168.10.158.48910 > 111.91.134.203.https: Flags [.], ack 4345, win 296, options [nop,nop,TS val 1183058 ecr 3820992077], length 0
17:02:29.275667 IP 192.168.10.158.48906 > 111.91.134.203.https: Flags [P.], seq 206:332, ack 4742, win 303, options [nop,nop,TS val 1183058 ecr 768179468], length 126
17:02:29.276403 IP 111.91.134.203.https > 192.168.10.158.48910: Flags [P.], seq 4345:4742, ack 206, win 122, options [nop,nop,TS val 3820992077 ecr 1183054], length 397
17:02:29.276410 IP 192.168.10.158.48910 > 111.91.134.203.https: Flags [.], ack 4742, win 319, options [nop,nop,TS val 1183058 ecr 3820992077], length 0
17:02:29.276422 IP 182.162.92.209.https > 192.168.10.158.38156: Flags [.], seq 339859:342755, ack 2515, win 139, options [nop,nop,TS val 2121337563 ecr 1183054], length 2896
17:02:29.276440 IP 182.162.92.209.https > 192.168.10.158.38156: Flags [.], seq 342755:351443, ack 2515, win 139, options [nop,nop,TS val 2121337563 ecr 1183055], length 8688
17:02:29.276444 IP 182.162.92.209.https > 192.168.10.158.38156: Flags [.], seq 351443:352891, ack 2606, win 139, options [nop,nop,TS val 2121337565 ecr 1183055], length 1448
17:02:29.276970 IP 192.168.10.158.38170 > 182.162.92.209.https: Flags [P.], seq 324:756, ack 3652, win 296, options [nop,nop,TS val 1183058 ecr 2121337560], length 432
17:02:29.277722 IP 192.168.10.158.48910 > 111.91.134.203.https: Flags [P.], seq 206:332, ack 4742, win 319, options [nop,nop,TS val 1183058 ecr 3820992077], length 126
17:02:29.277913 IP 192.168.10.158.38156 > 182.162.92.209.https: Flags [.], ack 352891, win 1444, options [nop,nop,TS val 1183058 ecr 2121337563], length 0
17:02:29.279226 IP 192.168.10.158.38156 > 182.162.92.209.https: Flags [P.], seq 2697:2788, ack 352891, win 1444, options [nop,nop,TS val 1183059 ecr 2121337563], length 91
17:02:29.284411 IP 182.162.92.209.https > 192.168.10.158.38156: Flags [P.], seq 352891:354339, ack 2606, win 139, options [nop,nop,TS val 2121337565 ecr 1183055], length 1448
17:02:29.284424 IP 182.162.92.209.https > 192.168.10.158.38156: Flags [.], seq 354339:355787, ack 2606, win 139, options [nop,nop,TS val 2121337565 ecr 1183055], length 1448
17:02:29.285152 IP 182.162.92.209.https > 192.168.10.158.38156: Flags [.], seq 355787:358683, ack 2606, win 139, options [nop,nop,TS val 2121337565 ecr 1183055], length 2896
17:02:29.285477 IP 192.168.10.158.38156 > 182.162.92.209.https: Flags [.], ack 358683, win 1444, options [nop,nop,TS val 1183060 ecr 2121337565], length 0
17:02:29.285903 IP 192.168.10.1.domain > 192.168.10.158.54476: 22725 NXDomain 0/1/0 (99)
17:02:29.285920 IP 182.162.92.209.https > 192.168.10.158.38156: Flags [.], seq 358683:363027, ack 2606, win 139, options [nop,nop,TS val 2121337565 ecr 1183055], length 4344
17:02:29.285928 IP 182.162.92.209.https > 192.168.10.158.38156: Flags [.], seq 363027:365923, ack 2606, win 139, options [nop,nop,TS val 2121337569 ecr 1183056], length 2896
17:02:29.285931 IP 182.162.92.209.https > 192.168.10.158.38156: Flags [.], seq 365923:367371, ack 2606, win 139, options [nop,nop,TS val 2121337576 ecr 1183057], length 1448
17:02:29.286058 IP 192.168.10.158.54476 > 192.168.10.1.domain: 53451+ PTR? 117.10.168.192.in-addr.arpa. (45)
17:02:29.286232 IP 192.168.10.158.38156 > 182.162.92.209.https: Flags [.], ack 367371, win 1444, options [nop,nop,TS val 1183061 ecr 2121337565], length 0
17:02:29.286261 IP 192.168.10.158.48910 > 111.91.134.203.https: Flags [F.], seq 332, ack 4742, win 319, options [nop,nop,TS val 1183061 ecr 3820992077], length 0
17:02:29.286308 IP 192.168.10.158.48906 > 111.91.134.203.https: Flags [P.], seq 332:385, ack 4742, win 303, options [nop,nop,TS val 1183061 ecr 768179468], length 53
17:02:29.286714 IP 192.168.10.158.38156 > 182.162.92.209.https: Flags [P.], seq 2788:2886, ack 367371, win 1444, options [nop,nop,TS val 1183061 ecr 2121337565], length 98
17:02:29.286875 IP 182.162.92.209.https > 192.168.10.158.38156: Flags [.], seq 367371:377507, ack 2606, win 139, options [nop,nop,TS val 2121337576 ecr 1183057], length 10136
17:02:29.286902 IP 192.168.10.158.38156 > 182.162.92.209.https: Flags [.], ack 377507, win 1444, options [nop,nop,TS val 1183061 ecr 2121337576], length 0
17:02:29.287411 IP 182.162.92.209.https > 192.168.10.158.38156: Flags [.], seq 377507:380403, ack 2606, win 139, options [nop,nop,TS val 2121337576 ecr 1183057], length 2896
17:02:29.287416 IP 182.162.92.209.https > 192.168.10.158.38156: Flags [.], seq 380403:381851, ack 2606, win 139, options [nop,nop,TS val 2121337577 ecr 1183057], length 1448
17:02:29.287424 IP 192.168.10.158.38156 > 182.162.92.209.https: Flags [.], ack 381851, win 1444, options [nop,nop,TS val 1183061 ecr 2121337576], length 0
17:02:29.287922 IP 192.168.10.158.38156 > 182.162.92.209.https: Flags [P.], seq 2886:2984, ack 381851, win 1444, options [nop,nop,TS val 1183061 ecr 2121337576], length 98
17:02:29.287927 IP 192.168.10.158.48906 > 111.91.134.203.https: Flags [P.], seq 385:970, ack 4742, win 303, options [nop,nop,TS val 1183061 ecr 768179468], length 585
17:02:29.291399 IP 182.162.92.209.https > 192.168.10.158.38156: Flags [.], seq 381851:383299, ack 2606, win 139, options [nop,nop,TS val 2121337577 ecr 1183057], length 1448
17:02:29.295358 IP 182.162.92.209.https > 192.168.10.158.38170: Flags [P.], seq 3652:3894, ack 324, win 122, options [nop,nop,TS val 2121337577 ecr 1183057], length 242
17:02:29.295369 IP 111.91.134.203.https > 192.168.10.158.48906: Flags [P.], seq 4742:5000, ack 332, win 122, options [nop,nop,TS val 768179484 ecr 1183058], length 258
17:02:29.295375 IP 111.91.134.203.https > 192.168.10.158.48906: Flags [P.], seq 5000:5069, ack 332, win 122, options [nop,nop,TS val 768179484 ecr 1183058], length 69
17:02:29.295379 IP 182.162.92.209.https > 192.168.10.158.38170: Flags [P.], seq 3894:3963, ack 324, win 122, options [nop,nop,TS val 2121337578 ecr 1183057], length 69
17:02:29.295381 IP 182.162.92.209.https > 192.168.10.158.38156: Flags [.], seq 383299:386195, ack 2606, win 139, options [nop,nop,TS val 2121337577 ecr 1183057], length 2896
17:02:29.295383 IP 182.162.92.209.https > 192.168.10.158.38170: Flags [P.], seq 3963:4001, ack 756, win 130, options [nop,nop,TS val 2121337582 ecr 1183058], length 38
17:02:29.295392 IP 182.162.92.209.https > 192.168.10.158.38170: Flags [P.], seq 4001:4277, ack 756, win 130, options [nop,nop,TS val 2121337582 ecr 1183058], length 276
17:02:29.295399 IP 111.91.134.203.https > 192.168.10.158.48910: Flags [P.], seq 4742:5000, ack 332, win 122, options [nop,nop,TS val 3820992098 ecr 1183058], length 258
17:02:29.295414 IP 192.168.10.158.48910 > 111.91.134.203.https: Flags [R], seq 3278789819, win 0, length 0
17:02:29.295427 IP 111.91.134.203.https > 192.168.10.158.48910: Flags [P.], seq 5000:5069, ack 332, win 122, options [nop,nop,TS val 3820992098 ecr 1183058], length 69
17:02:29.295430 IP 192.168.10.158.48910 > 111.91.134.203.https: Flags [R], seq 3278789819, win 0, length 0
17:02:29.295433 IP 192.168.10.158.38170 > 182.162.92.209.https: Flags [.], ack 4277, win 342, options [nop,nop,TS val 1183063 ecr 2121337577], length 0
17:02:29.295439 IP 182.162.92.209.https > 192.168.10.158.38156: Flags [.], seq 386195:397779, ack 2697, win 139, options [nop,nop,TS val 2121337582 ecr 1183057], length 11584
17:02:29.295444 IP 182.162.92.209.https > 192.168.10.158.38170: Flags [.], seq 4277:12965, ack 756, win 130, options [nop,nop,TS val 2121337583 ecr 1183058], length 8688
17:02:29.295447 IP 192.168.10.158.38170 > 182.162.92.209.https: Flags [.], ack 12965, win 477, options [nop,nop,TS val 1183063 ecr 2121337583], length 0
17:02:29.295721 IP 192.168.10.158.38170 > 182.162.92.209.https: Flags [P.], seq 756:794, ack 12965, win 477, options [nop,nop,TS val 1183063 ecr 2121337583], length 38
17:02:29.295740 IP 192.168.10.158.48906 > 111.91.134.203.https: Flags [.], ack 5069, win 325, options [nop,nop,TS val 1183063 ecr 768179484], length 0
17:02:29.295788 IP 192.168.10.158.38156 > 182.162.92.209.https: Flags [.], ack 397779, win 1444, options [nop,nop,TS val 1183063 ecr 2121337577], length 0
17:02:29.295912 IP 192.168.10.1.domain > 192.168.10.158.54476: 53451 NXDomain 0/1/0 (95)
17:02:29.295929 IP 182.162.92.209.https > 192.168.10.158.38156: Flags [.], seq 397779:403571, ack 2788, win 139, options [nop,nop,TS val 2121337586 ecr 1183059], length 5792
17:02:29.295934 IP 182.162.92.209.https > 192.168.10.158.38156: Flags [.], seq 403571:405019, ack 2788, win 139, options [nop,nop,TS val 2121337588 ecr 1183061], length 1448
17:02:29.295988 IP 192.168.10.158.38156 > 182.162.92.209.https: Flags [.], ack 405019, win 1444, options [nop,nop,TS val 1183063 ecr 2121337586], length 0
17:02:29.296098 IP 192.168.10.158.54476 > 192.168.10.1.domain: 5629+ PTR? 102.27.131.202.in-addr.arpa. (45)
17:02:29.296336 IP 192.168.10.158.48906 > 111.91.134.203.https: Flags [P.], seq 970:1008, ack 5069, win 325, options [nop,nop,TS val 1183063 ecr 768179484], length 38
17:02:29.296518 IP 192.168.10.158.38156 > 182.162.92.209.https: Flags [P.], seq 2984:3084, ack 405019, win 1444, options [nop,nop,TS val 1183063 ecr 2121337586], length 100
17:02:29.298238 IP 182.162.92.209.https > 192.168.10.158.38156: Flags [.], seq 405019:406467, ack 2788, win 139, options [nop,nop,TS val 2121337588 ecr 1183061], length 1448
17:02:29.300630 IP 182.162.92.209.https > 192.168.10.158.38156: Flags [.], seq 406467:412259, ack 2788, win 139, options [nop,nop,TS val 2121337588 ecr 1183061], length 5792
17:02:29.300639 IP 111.91.134.203.https > 192.168.10.158.48906: Flags [.], ack 970, win 131, options [nop,nop,TS val 768179496 ecr 1183061], length 0
17:02:29.300644 IP 111.91.134.203.https > 192.168.10.158.48906: Flags [P.], seq 5069:5107, ack 970, win 131, options [nop,nop,TS val 768179496 ecr 1183061], length 38
17:02:29.300646 IP 111.91.134.203.https > 192.168.10.158.48910: Flags [F.], seq 5069, ack 333, win 122, options [nop,nop,TS val 3820992104 ecr 1183061], length 0
17:02:29.300653 IP 192.168.10.158.38156 > 182.162.92.209.https: Flags [.], ack 412259, win 1444, options [nop,nop,TS val 1183064 ecr 2121337588], length 0
17:02:29.300662 IP 192.168.10.158.48910 > 111.91.134.203.https: Flags [R], seq 3278789820, win 0, length 0
17:02:29.300662 IP 182.162.92.209.https > 192.168.10.158.38156: Flags [P.], seq 412259:426887, ack 2886, win 139, options [nop,nop,TS val 2121337588 ecr 1183061], length 14628
17:02:29.300701 IP 192.168.10.158.38156 > 182.162.92.209.https: Flags [.], ack 426887, win 1444, options [nop,nop,TS val 1183064 ecr 2121337588], length 0
17:02:29.301052 IP 182.162.92.209.https > 192.168.10.158.38156: Flags [P.], seq 426887:428273, ack 2886, win 139, options [nop,nop,TS val 2121337589 ecr 1183061], length 1386
17:02:29.301057 IP 111.91.134.203.https > 192.168.10.158.48906: Flags [P.], seq 5107:6536, ack 970, win 131, options [nop,nop,TS val 768179497 ecr 1183061], length 1429
17:02:29.301062 IP 192.168.10.158.48906 > 111.91.134.203.https: Flags [.], ack 6536, win 348, options [nop,nop,TS val 1183064 ecr 768179496], length 0
17:02:29.301069 IP 111.91.134.203.https > 192.168.10.158.48906: Flags [P.], seq 6536:7749, ack 970, win 131, options [nop,nop,TS val 768179497 ecr 1183061], length 1213
17:02:29.301877 IP 192.168.10.158.38156 > 182.162.92.209.https: Flags [P.], seq 3084:3184, ack 428273, win 1444, options [nop,nop,TS val 1183064 ecr 2121337589], length 100
17:02:29.302232 IP 111.91.134.203.https > 192.168.10.158.48906: Flags [P.], seq 7749:7787, ack 970, win 131, options [nop,nop,TS val 768179497 ecr 1183061], length 38
17:02:29.302241 IP 111.91.134.203.https > 192.168.10.158.48906: Flags [P.], seq 7787:9216, ack 970, win 131, options [nop,nop,TS val 768179498 ecr 1183061], length 1429
17:02:29.302244 IP 192.168.10.158.48906 > 111.91.134.203.https: Flags [.], ack 9216, win 393, options [nop,nop,TS val 1183065 ecr 768179497], length 0
17:02:29.302252 IP 111.91.134.203.https > 192.168.10.158.48906: Flags [P.], seq 9216:10645, ack 970, win 131, options [nop,nop,TS val 768179498 ecr 1183061], length 1429
17:02:29.302255 IP 111.91.134.203.https > 192.168.10.158.48906: Flags [P.], seq 10645:11800, ack 970, win 131, options [nop,nop,TS val 768179498 ecr 1183061], length 1155
