** capture packet ** start---------------------------------
tcpdump: verbose output suppressed, use -v or -vv for full protocol decode
listening on wlp1s0, link-type EN10MB (Ethernet), capture size 262144 bytes
tcpdump: Unable to write output: Interrupted system call
21:41:15.277792 IP 192.168.10.158.43636 > 192.168.10.1.domain: 7385+ A? cc.naver.com. (30)
21:41:15.282355 IP 192.168.10.158.43636 > 192.168.10.1.domain: 38841+ A? search.naver.com. (34)
21:41:15.303915 IP 192.168.10.1.domain > 192.168.10.158.43636: 7385 5/0/0 CNAME cc.naver.com.akadns.net., CNAME kr-cc.naver.com.akadns.net., A 202.131.27.204, A 125.209.210.116, A 182.162.202.180 (135)
21:41:15.304177 IP 192.168.10.158.57520 > 202.131.27.204.https: Flags [S], seq 2362109056, win 29200, options [mss 1460,sackOK,TS val 3520286 ecr 0,nop,wscale 7], length 0
21:41:15.311978 IP 192.168.10.1.domain > 192.168.10.158.43636: 38841 3/0/0 CNAME search.naver.com.nheos.com., A 43.250.153.7, A 125.209.230.167 (103)
21:41:15.312305 IP 192.168.10.158.50722 > 43.250.153.7.https: Flags [S], seq 286782624, win 29200, options [mss 1460,sackOK,TS val 3520288 ecr 0,nop,wscale 7], length 0
21:41:15.320533 IP 202.131.27.204.https > 192.168.10.158.57520: Flags [S.], seq 755406693, ack 2362109057, win 14480, options [mss 1460,sackOK,TS val 3349322389 ecr 3520286,nop,wscale 7], length 0
21:41:15.320586 IP 192.168.10.158.57520 > 202.131.27.204.https: Flags [.], ack 1, win 229, options [nop,nop,TS val 3520291 ecr 3349322389], length 0
21:41:15.320840 IP 192.168.10.158.57520 > 202.131.27.204.https: Flags [P.], seq 1:201, ack 1, win 229, options [nop,nop,TS val 3520291 ecr 3349322389], length 200
21:41:15.324294 IP 43.250.153.7.https > 192.168.10.158.50722: Flags [S.], seq 3329646650, ack 286782625, win 28960, options [mss 1440,sackOK,TS val 1074171257 ecr 3520288,nop,wscale 7], length 0
21:41:15.324356 IP 192.168.10.158.50722 > 43.250.153.7.https: Flags [.], ack 1, win 229, options [nop,nop,TS val 3520291 ecr 1074171257], length 0
21:41:15.324670 IP 192.168.10.158.50722 > 43.250.153.7.https: Flags [P.], seq 1:205, ack 1, win 229, options [nop,nop,TS val 3520292 ecr 1074171257], length 204
21:41:15.338659 IP 202.131.27.204.https > 192.168.10.158.57520: Flags [.], ack 201, win 122, options [nop,nop,TS val 3349322405 ecr 3520291], length 0
21:41:15.378871 IP 43.250.153.7.https > 192.168.10.158.50722: Flags [P.], seq 1:2161, ack 205, win 235, options [nop,nop,TS val 1074171269 ecr 3520292], length 2160
21:41:15.378920 IP 192.168.10.158.50722 > 43.250.153.7.https: Flags [.], ack 2161, win 262, options [nop,nop,TS val 3520305 ecr 1074171269], length 0
21:41:15.378959 IP 202.131.27.204.https > 192.168.10.158.57520: Flags [P.], seq 1:3518, ack 201, win 122, options [nop,nop,TS val 3349322408 ecr 3520291], length 3517
21:41:15.378970 IP 192.168.10.158.57520 > 202.131.27.204.https: Flags [.], ack 3518, win 284, options [nop,nop,TS val 3520305 ecr 3349322408], length 0
21:41:15.380998 IP 192.168.10.158.50722 > 43.250.153.7.https: Flags [P.], seq 205:331, ack 2161, win 262, options [nop,nop,TS val 3520306 ecr 1074171269], length 126
21:41:15.388425 IP 192.168.10.158.57520 > 202.131.27.204.https: Flags [P.], seq 201:351, ack 3518, win 284, options [nop,nop,TS val 3520307 ecr 3349322408], length 150
21:41:15.402812 IP 192.168.10.158.50722 > 43.250.153.7.https: Flags [P.], seq 331:384, ack 2161, win 262, options [nop,nop,TS val 3520311 ecr 1074171269], length 53
21:41:15.403987 IP 192.168.10.158.50722 > 43.250.153.7.https: Flags [P.], seq 384:923, ack 2161, win 262, options [nop,nop,TS val 3520311 ecr 1074171269], length 539
21:41:15.422005 IP 43.250.153.7.https > 192.168.10.158.50722: Flags [P.], seq 1449:2161, ack 205, win 235, options [nop,nop,TS val 1074171291 ecr 3520292], length 712
21:41:15.422051 IP 192.168.10.158.50722 > 43.250.153.7.https: Flags [.], ack 2161, win 262, options [nop,nop,TS val 3520316 ecr 1074171291,nop,nop,sack 1 {1449:2161}], length 0
21:41:15.428410 IP 43.250.153.7.https > 192.168.10.158.50722: Flags [P.], seq 2161:2403, ack 331, win 235, options [nop,nop,TS val 1074171327 ecr 3520306], length 242
21:41:15.428432 IP 192.168.10.158.50722 > 43.250.153.7.https: Flags [.], ack 2403, win 285, options [nop,nop,TS val 3520317 ecr 1074171327], length 0
21:41:15.428466 IP 202.131.27.204.https > 192.168.10.158.57520: Flags [P.], seq 3518:3784, ack 351, win 130, options [nop,nop,TS val 3349322471 ecr 3520307], length 266
21:41:15.428477 IP 43.250.153.7.https > 192.168.10.158.50722: Flags [P.], seq 2403:2453, ack 384, win 235, options [nop,nop,TS val 1074171346 ecr 3520311], length 50
21:41:15.428484 IP 192.168.10.158.50722 > 43.250.153.7.https: Flags [.], ack 2453, win 285, options [nop,nop,TS val 3520318 ecr 1074171346], length 0
21:41:15.428490 IP 43.250.153.7.https > 192.168.10.158.50722: Flags [P.], seq 2453:2491, ack 923, win 244, options [nop,nop,TS val 1074171347 ecr 3520311], length 38
21:41:15.428498 IP 192.168.10.158.50722 > 43.250.153.7.https: Flags [.], ack 2491, win 285, options [nop,nop,TS val 3520318 ecr 1074171347], length 0
21:41:15.428503 IP 43.250.153.7.https > 192.168.10.158.50722: Flags [P.], seq 2491:2874, ack 923, win 244, options [nop,nop,TS val 1074171350 ecr 3520311], length 383
21:41:15.428508 IP 192.168.10.158.50722 > 43.250.153.7.https: Flags [.], ack 2874, win 308, options [nop,nop,TS val 3520318 ecr 1074171350], length 0
21:41:15.429884 IP 192.168.10.158.50722 > 43.250.153.7.https: Flags [P.], seq 923:961, ack 2874, win 308, options [nop,nop,TS val 3520318 ecr 1074171350], length 38
21:41:15.434126 IP 192.168.10.158.57520 > 202.131.27.204.https: Flags [P.], seq 351:980, ack 3784, win 306, options [nop,nop,TS val 3520319 ecr 3349322471], length 629
21:41:15.468298 IP 202.131.27.204.https > 192.168.10.158.57520: Flags [P.], seq 3784:4237, ack 980, win 140, options [nop,nop,TS val 3349322541 ecr 3520319], length 453
21:41:15.469434 IP 192.168.10.158.57520 > 202.131.27.204.https: Flags [F.], seq 980, ack 4237, win 329, options [nop,nop,TS val 3520328 ecr 3349322541], length 0
21:41:15.470691 IP 202.131.27.204.https > 192.168.10.158.57520: Flags [FP.], seq 4237:4290, ack 980, win 140, options [nop,nop,TS val 3349322541 ecr 3520319], length 53
21:41:15.470726 IP 192.168.10.158.57520 > 202.131.27.204.https: Flags [R], seq 2362110036, win 0, length 0
21:41:15.480545 IP 43.250.153.7.https > 192.168.10.158.50722: Flags [.], ack 961, win 244, options [nop,nop,TS val 1074171413 ecr 3520318], length 0
21:41:15.482815 IP 202.131.27.204.https > 192.168.10.158.57520: Flags [.], ack 981, win 140, options [nop,nop,TS val 3349322552 ecr 3520328], length 0
21:41:15.482924 IP 192.168.10.158.57520 > 202.131.27.204.https: Flags [R], seq 2362110037, win 0, length 0
21:41:15.560504 IP 43.250.153.7.https > 192.168.10.158.50722: Flags [P.], seq 2874:4303, ack 961, win 244, options [nop,nop,TS val 1074171475 ecr 3520318], length 1429
21:41:15.560535 IP 43.250.153.7.https > 192.168.10.158.50722: Flags [P.], seq 4303:5732, ack 961, win 244, options [nop,nop,TS val 1074171475 ecr 3520318], length 1429
21:41:15.560553 IP 192.168.10.158.50722 > 43.250.153.7.https: Flags [.], ack 5732, win 353, options [nop,nop,TS val 3520351 ecr 1074171475], length 0
21:41:15.560588 IP 43.250.153.7.https > 192.168.10.158.50722: Flags [P.], seq 5732:7337, ack 961, win 244, options [nop,nop,TS val 1074171475 ecr 3520318], length 1605
21:41:15.560597 IP 192.168.10.158.50722 > 43.250.153.7.https: Flags [.], ack 7337, win 378, options [nop,nop,TS val 3520351 ecr 1074171475], length 0
21:41:15.560611 IP 43.250.153.7.https > 192.168.10.158.50722: Flags [P.], seq 7337:8766, ack 961, win 244, options [nop,nop,TS val 1074171475 ecr 3520318], length 1429
21:41:15.560626 IP 43.250.153.7.https > 192.168.10.158.50722: Flags [P.], seq 8766:11624, ack 961, win 244, options [nop,nop,TS val 1074171475 ecr 3520318], length 2858
21:41:15.560635 IP 192.168.10.158.50722 > 43.250.153.7.https: Flags [.], ack 11624, win 445, options [nop,nop,TS val 3520351 ecr 1074171475], length 0
21:41:15.560735 IP 43.250.153.7.https > 192.168.10.158.50722: Flags [.], seq 11624:13072, ack 961, win 244, options [nop,nop,TS val 1074171475 ecr 3520318], length 1448
21:41:15.567307 IP 43.250.153.7.https > 192.168.10.158.50722: Flags [.], seq 13072:15968, ack 961, win 244, options [nop,nop,TS val 1074171475 ecr 3520318], length 2896
21:41:15.567365 IP 192.168.10.158.50722 > 43.250.153.7.https: Flags [.], ack 15968, win 513, options [nop,nop,TS val 3520352 ecr 1074171475], length 0
21:41:15.573883 IP 43.250.153.7.https > 192.168.10.158.50722: Flags [.], seq 15968:17416, ack 961, win 244, options [nop,nop,TS val 1074171503 ecr 3520351], length 1448
21:41:15.574798 IP 43.250.153.7.https > 192.168.10.158.50722: Flags [.], seq 17416:18864, ack 961, win 244, options [nop,nop,TS val 1074171503 ecr 3520351], length 1448
21:41:15.574817 IP 192.168.10.158.50722 > 43.250.153.7.https: Flags [.], ack 18864, win 558, options [nop,nop,TS val 3520354 ecr 1074171503], length 0
21:41:15.581367 IP 43.250.153.7.https > 192.168.10.158.50722: Flags [.], seq 18864:21760, ack 961, win 244, options [nop,nop,TS val 1074171503 ecr 3520351], length 2896
21:41:15.581403 IP 192.168.10.158.50722 > 43.250.153.7.https: Flags [.], ack 21760, win 603, options [nop,nop,TS val 3520356 ecr 1074171503], length 0
21:41:15.581575 IP 43.250.153.7.https > 192.168.10.158.50722: Flags [.], seq 21760:27552, ack 961, win 244, options [nop,nop,TS val 1074171503 ecr 3520351], length 5792
21:41:15.581584 IP 192.168.10.158.50722 > 43.250.153.7.https: Flags [.], ack 27552, win 694, options [nop,nop,TS val 3520356 ecr 1074171503], length 0
21:41:15.582323 IP 43.250.153.7.https > 192.168.10.158.50722: Flags [.], seq 27552:34792, ack 961, win 244, options [nop,nop,TS val 1074171503 ecr 3520351], length 7240
21:41:15.582360 IP 192.168.10.158.50722 > 43.250.153.7.https: Flags [.], ack 34792, win 807, options [nop,nop,TS val 3520356 ecr 1074171503], length 0
21:41:15.582426 IP 43.250.153.7.https > 192.168.10.158.50722: Flags [.], seq 34792:37688, ack 961, win 244, options [nop,nop,TS val 1074171510 ecr 3520352], length 2896
21:41:15.582453 IP 192.168.10.158.50722 > 43.250.153.7.https: Flags [.], ack 37688, win 852, options [nop,nop,TS val 3520356 ecr 1074171510], length 0
21:41:15.598225 IP 192.168.10.158.47696 > 182.162.92.42.https: Flags [P.], seq 1931554236:1931554393, ack 2944916814, win 2581, options [nop,nop,TS val 3520360 ecr 2143348721], length 157
21:41:15.602093 IP 192.168.10.158.47696 > 182.162.92.42.https: Flags [P.], seq 157:246, ack 1, win 2581, options [nop,nop,TS val 3520361 ecr 2143348721], length 89
21:41:15.606214 IP 192.168.10.158.47696 > 182.162.92.42.https: Flags [P.], seq 246:1015, ack 1, win 2581, options [nop,nop,TS val 3520362 ecr 2143348721], length 769
21:41:15.607243 IP 43.250.153.7.https > 192.168.10.158.50722: Flags [.], seq 37688:44928, ack 961, win 244, options [nop,nop,TS val 1074171510 ecr 3520352], length 7240
21:41:15.607254 IP 192.168.10.158.50722 > 43.250.153.7.https: Flags [.], ack 44928, win 965, options [nop,nop,TS val 3520362 ecr 1074171510], length 0
21:41:15.607262 IP 43.250.153.7.https > 192.168.10.158.50722: Flags [.], seq 44928:46376, ack 961, win 244, options [nop,nop,TS val 1074171517 ecr 3520354], length 1448
21:41:15.610273 IP 43.250.153.7.https > 192.168.10.158.50722: Flags [.], seq 46376:50720, ack 961, win 244, options [nop,nop,TS val 1074171517 ecr 3520354], length 4344
21:41:15.610287 IP 192.168.10.158.50722 > 43.250.153.7.https: Flags [.], ack 50720, win 1056, options [nop,nop,TS val 3520363 ecr 1074171517], length 0
21:41:15.610300 IP 43.250.153.7.https > 192.168.10.158.50722: Flags [.], seq 50720:56512, ack 961, win 244, options [nop,nop,TS val 1074171525 ecr 3520356], length 5792
21:41:15.610302 IP 192.168.10.158.50722 > 43.250.153.7.https: Flags [.], ack 56512, win 1146, options [nop,nop,TS val 3520363 ecr 1074171525], length 0
21:41:15.611674 IP 43.250.153.7.https > 192.168.10.158.50722: Flags [.], seq 56512:66648, ack 961, win 244, options [nop,nop,TS val 1074171525 ecr 3520356], length 10136
21:41:15.611690 IP 192.168.10.158.50722 > 43.250.153.7.https: Flags [.], ack 66648, win 1305, options [nop,nop,TS val 3520363 ecr 1074171525], length 0
21:41:15.612428 IP 43.250.153.7.https > 192.168.10.158.50722: Flags [.], seq 66648:69544, ack 961, win 244, options [nop,nop,TS val 1074171525 ecr 3520356], length 2896
21:41:15.612436 IP 192.168.10.158.50722 > 43.250.153.7.https: Flags [.], ack 69544, win 1350, options [nop,nop,TS val 3520363 ecr 1074171525], length 0
21:41:15.613422 IP 192.168.10.158.47696 > 182.162.92.42.https: Flags [P.], seq 1015:1105, ack 1, win 2581, options [nop,nop,TS val 3520364 ecr 2143348721], length 90
21:41:15.614332 IP 43.250.153.7.https > 192.168.10.158.50722: Flags [.], seq 69544:73888, ack 961, win 244, options [nop,nop,TS val 1074171525 ecr 3520356], length 4344
21:41:15.614347 IP 192.168.10.158.50722 > 43.250.153.7.https: Flags [.], ack 73888, win 1404, options [nop,nop,TS val 3520364 ecr 1074171525], length 0
21:41:15.614629 IP 192.168.10.158.47696 > 182.162.92.42.https: Flags [P.], seq 1105:1195, ack 1, win 2581, options [nop,nop,TS val 3520364 ecr 2143348721], length 90
21:41:15.614924 IP 43.250.153.7.https > 192.168.10.158.50722: Flags [.], seq 73888:75336, ack 961, win 244, options [nop,nop,TS val 1074171525 ecr 3520356], length 1448
21:41:15.615254 IP 43.250.153.7.https > 192.168.10.158.50722: Flags [.], seq 75336:76784, ack 961, win 244, options [nop,nop,TS val 1074171525 ecr 3520356], length 1448
21:41:15.615259 IP 192.168.10.158.50722 > 43.250.153.7.https: Flags [.], ack 76784, win 1436, options [nop,nop,TS val 3520364 ecr 1074171525], length 0
21:41:15.618583 IP 192.168.10.158.47696 > 182.162.92.42.https: Flags [P.], seq 1195:1277, ack 1, win 2581, options [nop,nop,TS val 3520365 ecr 2143348721], length 82
21:41:15.621388 IP 192.168.10.158.47696 > 182.162.92.42.https: Flags [P.], seq 1277:1373, ack 1, win 2581, options [nop,nop,TS val 3520366 ecr 2143348721], length 96
21:41:15.622954 IP 43.250.153.7.https > 192.168.10.158.50722: Flags [.], seq 76784:78232, ack 961, win 244, options [nop,nop,TS val 1074171525 ecr 3520356], length 1448
21:41:15.626151 IP 43.250.153.7.https > 192.168.10.158.50722: Flags [.], seq 78232:81128, ack 961, win 244, options [nop,nop,TS val 1074171525 ecr 3520356], length 2896
21:41:15.626190 IP 43.250.153.7.https > 192.168.10.158.50722: Flags [P.], seq 81128:83733, ack 961, win 244, options [nop,nop,TS val 1074171525 ecr 3520356], length 2605
21:41:15.626198 IP 182.162.92.42.https > 192.168.10.158.47696: Flags [.], seq 1:10137, ack 157, win 172, options [nop,nop,TS val 2143351264 ecr 3520360], length 10136
21:41:15.626205 IP 192.168.10.158.50722 > 43.250.153.7.https: Flags [.], ack 83733, win 1440, options [nop,nop,TS val 3520367 ecr 1074171525], length 0
21:41:15.626213 IP 192.168.10.158.47696 > 182.162.92.42.https: Flags [.], ack 10137, win 2622, options [nop,nop,TS val 3520367 ecr 2143351264], length 0
21:41:15.628183 IP 182.162.92.42.https > 192.168.10.158.47696: Flags [P.], seq 10137:16414, ack 157, win 172, options [nop,nop,TS val 2143351264 ecr 3520360], length 6277
21:41:15.628195 IP 192.168.10.158.47696 > 182.162.92.42.https: Flags [.], ack 16414, win 2648, options [nop,nop,TS val 3520367 ecr 2143351264], length 0
21:41:15.628206 IP 182.162.92.42.https > 192.168.10.158.47696: Flags [P.], seq 16414:17352, ack 157, win 172, options [nop,nop,TS val 2143351265 ecr 3520360], length 938
21:41:15.628207 IP 192.168.10.158.47696 > 182.162.92.42.https: Flags [.], ack 17352, win 2641, options [nop,nop,TS val 3520367 ecr 2143351265], length 0
21:41:15.628213 IP 182.162.92.42.https > 192.168.10.158.47696: Flags [P.], seq 17352:24998, ack 157, win 172, options [nop,nop,TS val 2143351265 ecr 3520360], length 7646
21:41:15.628215 IP 192.168.10.158.47696 > 182.162.92.42.https: Flags [.], ack 24998, win 2638, options [nop,nop,TS val 3520367 ecr 2143351265], length 0
21:41:15.628216 IP 182.162.92.42.https > 192.168.10.158.47696: Flags [.], ack 1015, win 184, options [nop,nop,TS val 2143351272 ecr 3520361], length 0
21:41:15.628225 IP 182.162.92.42.https > 192.168.10.158.47696: Flags [.], seq 24998:29342, ack 1015, win 184, options [nop,nop,TS val 2143351272 ecr 3520361], length 4344
21:41:15.628228 IP 192.168.10.158.47696 > 182.162.92.42.https: Flags [.], ack 29342, win 2605, options [nop,nop,TS val 3520367 ecr 2143351272], length 0
21:41:15.634371 IP 182.162.92.42.https > 192.168.10.158.47696: Flags [.], seq 29342:38030, ack 1015, win 184, options [nop,nop,TS val 2143351272 ecr 3520361], length 8688
21:41:15.634393 IP 192.168.10.158.47696 > 182.162.92.42.https: Flags [.], ack 38030, win 2638, options [nop,nop,TS val 3520369 ecr 2143351272], length 0
21:41:15.634411 IP 182.162.92.42.https > 192.168.10.158.47696: Flags [.], ack 1195, win 184, options [nop,nop,TS val 2143351280 ecr 3520364], length 0
21:41:15.635177 IP 182.162.92.42.https > 192.168.10.158.47696: Flags [.], ack 1373, win 184, options [nop,nop,TS val 2143351286 ecr 3520365], length 0
21:41:15.635224 IP 182.162.92.42.https > 192.168.10.158.47696: Flags [.], seq 38030:39478, ack 1373, win 184, options [nop,nop,TS val 2143351292 ecr 3520367], length 1448
21:41:15.635253 IP 192.168.10.158.47696 > 182.162.92.42.https: Flags [.], ack 39478, win 2674, options [nop,nop,TS val 3520369 ecr 2143351292], length 0
21:41:15.636115 IP 182.162.92.42.https > 192.168.10.158.47696: Flags [.], seq 39478:49614, ack 1373, win 184, options [nop,nop,TS val 2143351292 ecr 3520367], length 10136
21:41:15.636150 IP 192.168.10.158.47696 > 182.162.92.42.https: Flags [.], ack 49614, win 2622, options [nop,nop,TS val 3520369 ecr 2143351292], length 0
21:41:15.638510 IP 182.162.92.42.https > 192.168.10.158.47696: Flags [.], seq 49614:51062, ack 1373, win 184, options [nop,nop,TS val 2143351296 ecr 3520367], length 1448
21:41:15.638551 IP 192.168.10.158.47696 > 182.162.92.42.https: Flags [.], ack 51062, win 2674, options [nop,nop,TS val 3520370 ecr 2143351296], length 0
21:41:15.639244 IP 182.162.92.42.https > 192.168.10.158.47696: Flags [.], seq 51062:61198, ack 1373, win 184, options [nop,nop,TS val 2143351296 ecr 3520367], length 10136
21:41:15.639259 IP 192.168.10.158.47696 > 182.162.92.42.https: Flags [.], ack 61198, win 2622, options [nop,nop,TS val 3520370 ecr 2143351296], length 0
21:41:15.643759 IP 182.162.92.42.https > 192.168.10.158.47696: Flags [.], seq 61198:66990, ack 1373, win 184, options [nop,nop,TS val 2143351296 ecr 3520367], length 5792
21:41:15.643790 IP 192.168.10.158.47696 > 182.162.92.42.https: Flags [.], ack 66990, win 2670, options [nop,nop,TS val 3520371 ecr 2143351296], length 0
21:41:15.643807 IP 182.162.92.42.https > 192.168.10.158.47696: Flags [.], seq 66990:69886, ack 1373, win 184, options [nop,nop,TS val 2143351297 ecr 3520367], length 2896
21:41:15.643810 IP 192.168.10.158.47696 > 182.162.92.42.https: Flags [.], ack 69886, win 2648, options [nop,nop,TS val 3520371 ecr 2143351297], length 0
21:41:15.650325 IP 182.162.92.42.https > 192.168.10.158.47696: Flags [.], seq 69886:75678, ack 1373, win 184, options [nop,nop,TS val 2143351299 ecr 3520369], length 5792
21:41:15.650344 IP 192.168.10.158.47696 > 182.162.92.42.https: Flags [.], ack 75678, win 2670, options [nop,nop,TS val 3520373 ecr 2143351299], length 0
21:41:15.656228 IP 182.162.92.42.https > 192.168.10.158.47696: Flags [.], seq 75678:78574, ack 1373, win 184, options [nop,nop,TS val 2143351299 ecr 3520369], length 2896
21:41:15.656239 IP 192.168.10.158.47696 > 182.162.92.42.https: Flags [.], ack 78574, win 2674, options [nop,nop,TS val 3520374 ecr 2143351299], length 0
21:41:15.663625 IP 182.162.92.42.https > 192.168.10.158.47696: Flags [.], seq 78574:87262, ack 1373, win 184, options [nop,nop,TS val 2143351307 ecr 3520369], length 8688
21:41:15.663694 IP 192.168.10.158.47696 > 182.162.92.42.https: Flags [.], ack 87262, win 2638, options [nop,nop,TS val 3520376 ecr 2143351307], length 0
21:41:15.663870 IP 182.162.92.42.https > 192.168.10.158.47696: Flags [.], seq 87262:93054, ack 1373, win 184, options [nop,nop,TS val 2143351307 ecr 3520369], length 5792
21:41:15.663892 IP 192.168.10.158.47696 > 182.162.92.42.https: Flags [.], ack 93054, win 2670, options [nop,nop,TS val 3520376 ecr 2143351307], length 0
21:41:15.663931 IP 182.162.92.42.https > 192.168.10.158.47696: Flags [.], seq 93054:98846, ack 1373, win 184, options [nop,nop,TS val 2143351307 ecr 3520370], length 5792
21:41:15.663950 IP 192.168.10.158.47696 > 182.162.92.42.https: Flags [.], ack 98846, win 2625, options [nop,nop,TS val 3520376 ecr 2143351307], length 0
21:41:15.671910 IP 182.162.92.42.https > 192.168.10.158.47696: Flags [.], seq 98846:104638, ack 1373, win 184, options [nop,nop,TS val 2143351307 ecr 3520370], length 5792
21:41:15.671923 IP 192.168.10.158.47696 > 182.162.92.42.https: Flags [.], ack 104638, win 2670, options [nop,nop,TS val 3520378 ecr 2143351307], length 0
21:41:15.671960 IP 182.162.92.42.https > 192.168.10.158.47696: Flags [.], seq 104638:108982, ack 1373, win 184, options [nop,nop,TS val 2143351312 ecr 3520371], length 4344
21:41:15.671963 IP 192.168.10.158.47696 > 182.162.92.42.https: Flags [.], ack 108982, win 2674, options [nop,nop,TS val 3520378 ecr 2143351312], length 0
21:41:15.677631 IP 182.162.92.42.https > 192.168.10.158.47696: Flags [.], seq 108982:113326, ack 1373, win 184, options [nop,nop,TS val 2143351312 ecr 3520371], length 4344
21:41:15.677636 IP 192.168.10.158.47696 > 182.162.92.42.https: Flags [.], ack 113326, win 2674, options [nop,nop,TS val 3520380 ecr 2143351312], length 0
21:41:15.687597 IP 182.162.92.42.https > 192.168.10.158.47696: Flags [.], seq 113326:119118, ack 1373, win 184, options [nop,nop,TS val 2143351325 ecr 3520373], length 5792
21:41:15.687609 IP 182.162.92.42.https > 192.168.10.158.47696: Flags [P.], seq 119118:122014, ack 1373, win 184, options [nop,nop,TS val 2143351325 ecr 3520374], length 2896
21:41:15.687613 IP 182.162.92.42.https > 192.168.10.158.47696: Flags [.], seq 122014:123462, ack 1373, win 184, options [nop,nop,TS val 2143351329 ecr 3520376], length 1448
21:41:15.687631 IP 192.168.10.158.47696 > 182.162.92.42.https: Flags [.], ack 123462, win 2674, options [nop,nop,TS val 3520382 ecr 2143351325], length 0
21:41:15.694287 IP 182.162.92.42.https > 192.168.10.158.47696: Flags [.], seq 123462:126358, ack 1373, win 184, options [nop,nop,TS val 2143351329 ecr 3520376], length 2896
21:41:15.694304 IP 192.168.10.158.47696 > 182.162.92.42.https: Flags [.], ack 126358, win 2674, options [nop,nop,TS val 3520384 ecr 2143351329], length 0
21:41:15.694450 IP 182.162.92.42.https > 192.168.10.158.47696: Flags [.], seq 126358:130702, ack 1373, win 184, options [nop,nop,TS val 2143351329 ecr 3520376], length 4344
21:41:15.694492 IP 182.162.92.42.https > 192.168.10.158.47696: Flags [.], seq 130702:142286, ack 1373, win 184, options [nop,nop,TS val 2143351334 ecr 3520376], length 11584
21:41:15.694517 IP 182.162.92.42.https > 192.168.10.158.47696: Flags [.], seq 142286:143734, ack 1373, win 184, options [nop,nop,TS val 2143351337 ecr 3520378], length 1448
21:41:15.695112 IP 192.168.10.158.47696 > 182.162.92.42.https: Flags [.], ack 143734, win 2539, options [nop,nop,TS val 3520384 ecr 2143351329], length 0
21:41:15.697290 IP 182.162.92.42.https > 192.168.10.158.47696: Flags [.], seq 143734:150974, ack 1373, win 184, options [nop,nop,TS val 2143351337 ecr 3520378], length 7240
21:41:15.697306 IP 192.168.10.158.47696 > 182.162.92.42.https: Flags [.], ack 150974, win 2654, options [nop,nop,TS val 3520385 ecr 2143351337], length 0
21:41:15.697340 IP 182.162.92.42.https > 192.168.10.158.47696: Flags [.], seq 150974:153870, ack 1373, win 184, options [nop,nop,TS val 2143351350 ecr 3520380], length 2896
21:41:15.697356 IP 192.168.10.158.47696 > 182.162.92.42.https: Flags [.], ack 153870, win 2674, options [nop,nop,TS val 3520385 ecr 2143351350], length 0
21:41:15.697651 IP 192.168.10.158.43636 > 192.168.10.1.domain: 61601+ PTR? 1.10.168.192.in-addr.arpa. (43)
21:41:15.699001 IP 182.162.92.42.https > 192.168.10.158.47696: Flags [.], seq 153870:156766, ack 1373, win 184, options [nop,nop,TS val 2143351350 ecr 3520380], length 2896
21:41:15.699049 IP 192.168.10.158.47696 > 182.162.92.42.https: Flags [.], ack 156766, win 2674, options [nop,nop,TS val 3520385 ecr 2143351350], length 0
21:41:15.699080 IP 182.162.92.42.https > 192.168.10.158.47696: Flags [.], seq 156766:158214, ack 1373, win 184, options [nop,nop,TS val 2143351356 ecr 3520382], length 1448
21:41:15.700730 IP 182.162.92.42.https > 192.168.10.158.47696: Flags [.], seq 158214:159662, ack 1373, win 184, options [nop,nop,TS val 2143351356 ecr 3520382], length 1448
21:41:15.700753 IP 192.168.10.158.47696 > 182.162.92.42.https: Flags [.], ack 159662, win 2674, options [nop,nop,TS val 3520386 ecr 2143351356], length 0
21:41:15.702727 IP 182.162.92.42.https > 192.168.10.158.47696: Flags [.], seq 159662:162558, ack 1373, win 184, options [nop,nop,TS val 2143351356 ecr 3520382], length 2896
21:41:15.702742 IP 192.168.10.158.47696 > 182.162.92.42.https: Flags [.], ack 162558, win 2674, options [nop,nop,TS val 3520386 ecr 2143351356], length 0
21:41:15.702778 IP 182.162.92.42.https > 192.168.10.158.47696: Flags [.], seq 162558:165454, ack 1373, win 184, options [nop,nop,TS val 2143351356 ecr 3520382], length 2896
21:41:15.702781 IP 192.168.10.158.47696 > 182.162.92.42.https: Flags [.], ack 165454, win 2674, options [nop,nop,TS val 3520386 ecr 2143351356], length 0
21:41:15.713532 IP 182.162.92.42.https > 192.168.10.158.47696: Flags [.], seq 165454:171246, ack 1373, win 184, options [nop,nop,TS val 2143351361 ecr 3520384], length 5792
21:41:15.713588 IP 192.168.10.158.47696 > 182.162.92.42.https: Flags [.], ack 171246, win 2674, options [nop,nop,TS val 3520389 ecr 2143351361], length 0
21:41:15.714808 IP 182.162.92.42.https > 192.168.10.158.47696: Flags [.], seq 171246:175590, ack 1373, win 184, options [nop,nop,TS val 2143351361 ecr 3520384], length 4344
21:41:15.714814 IP 192.168.10.158.47696 > 182.162.92.42.https: Flags [.], ack 175590, win 2674, options [nop,nop,TS val 3520389 ecr 2143351361], length 0
21:41:15.719116 IP 182.162.92.42.https > 192.168.10.158.47696: Flags [.], seq 175590:181382, ack 1373, win 184, options [nop,nop,TS val 2143351361 ecr 3520384], length 5792
21:41:15.719168 IP 192.168.10.158.47696 > 182.162.92.42.https: Flags [.], ack 181382, win 2674, options [nop,nop,TS val 3520390 ecr 2143351361], length 0
21:41:15.720003 IP 182.162.92.42.https > 192.168.10.158.47696: Flags [P.], seq 181382:185726, ack 1373, win 184, options [nop,nop,TS val 2143351361 ecr 3520384], length 4344
21:41:15.720013 IP 192.168.10.158.47696 > 182.162.92.42.https: Flags [.], ack 185726, win 2674, options [nop,nop,TS val 3520390 ecr 2143351361], length 0
21:41:15.720033 IP 182.162.92.42.https > 192.168.10.158.47696: Flags [.], seq 185726:191518, ack 1373, win 184, options [nop,nop,TS val 2143351364 ecr 3520385], length 5792
21:41:15.720071 IP 192.168.10.158.47696 > 182.162.92.42.https: Flags [.], ack 191518, win 2674, options [nop,nop,TS val 3520390 ecr 2143351364], length 0
21:41:15.727311 IP 192.168.10.1.domain > 192.168.10.158.43636: 61601 NXDomain 0/1/0 (78)
21:41:15.727334 IP 182.162.92.42.https > 192.168.10.158.47696: Flags [P.], seq 191518:194416, ack 1373, win 184, options [nop,nop,TS val 2143351364 ecr 3520385], length 2898
21:41:15.727347 IP 192.168.10.158.47696 > 182.162.92.42.https: Flags [.], ack 194416, win 2674, options [nop,nop,TS val 3520392 ecr 2143351364], length 0
21:41:15.727518 IP 192.168.10.158.43636 > 192.168.10.1.domain: 49362+ PTR? 158.10.168.192.in-addr.arpa. (45)
21:41:15.729341 IP 192.168.10.158.47696 > 182.162.92.42.https: Flags [P.], seq 1373:1468, ack 194416, win 2674, options [nop,nop,TS val 3520393 ecr 2143351364], length 95
21:41:15.733547 IP 192.168.10.1.domain > 192.168.10.158.43636: 49362 NXDomain 0/1/0 (80)
21:41:15.733787 IP 192.168.10.158.43636 > 192.168.10.1.domain: 54693+ PTR? 204.27.131.202.in-addr.arpa. (45)
21:41:15.735381 IP 125.209.226.239.https > 192.168.10.158.49616: Flags [P.], seq 3641745470:3641745501, ack 3228115450, win 148, length 31
21:41:15.735396 IP 192.168.10.158.49616 > 125.209.226.239.https: Flags [.], ack 31, win 646, length 0
21:41:15.736840 IP 125.209.226.239.https > 192.168.10.158.49616: Flags [F.], seq 31, ack 1, win 148, length 0
21:41:15.738326 IP 182.162.92.42.https > 192.168.10.158.47696: Flags [.], seq 194416:195864, ack 1468, win 184, options [nop,nop,TS val 2143351397 ecr 3520393], length 1448
21:41:15.739928 IP 182.162.92.42.https > 192.168.10.158.47696: Flags [P.], seq 195864:195913, ack 1468, win 184, options [nop,nop,TS val 2143351397 ecr 3520393], length 49
21:41:15.739943 IP 192.168.10.158.47696 > 182.162.92.42.https: Flags [.], ack 195913, win 2674, options [nop,nop,TS val 3520395 ecr 2143351397], length 0
21:41:15.740814 IP 192.168.10.158.47696 > 182.162.92.42.https: Flags [P.], seq 1468:1565, ack 195913, win 2674, options [nop,nop,TS val 3520396 ecr 2143351397], length 97
21:41:15.744491 IP 192.168.10.1.domain > 192.168.10.158.43636: 54693 NXDomain 0/1/0 (104)
21:41:15.744663 IP 192.168.10.158.43636 > 192.168.10.1.domain: 35811+ PTR? 7.153.250.43.in-addr.arpa. (43)
21:41:15.749900 IP 182.162.92.42.https > 192.168.10.158.47696: Flags [P.], seq 195913:197222, ack 1565, win 184, options [nop,nop,TS val 2143351407 ecr 3520396], length 1309
21:41:15.755565 IP 192.168.10.158.49616 > 125.209.226.239.https: Flags [R.], seq 1, ack 32, win 646, length 0
21:41:15.756256 IP 192.168.10.158.43636 > 192.168.10.1.domain: 31059+ A? phinf.pstatic.net. (35)
21:41:15.756686 IP 192.168.10.158.47696 > 182.162.92.42.https: Flags [P.], seq 1565:1653, ack 197222, win 2674, options [nop,nop,TS val 3520400 ecr 2143351407], length 88
21:41:15.757398 IP 192.168.10.158.47696 > 182.162.92.42.https: Flags [P.], seq 1653:1755, ack 197222, win 2674, options [nop,nop,TS val 3520400 ecr 2143351407], length 102
21:41:15.758793 IP 192.168.10.158.47696 > 182.162.92.42.https: Flags [P.], seq 1755:2162, ack 197222, win 2674, options [nop,nop,TS val 3520400 ecr 2143351407], length 407
21:41:15.759021 IP 192.168.10.1.domain > 192.168.10.158.43636: 35811 NXDomain 0/1/0 (102)
21:41:15.759851 IP 192.168.10.158.43636 > 192.168.10.1.domain: 7434+ PTR? 42.92.162.182.in-addr.arpa. (44)
21:41:15.760519 IP 192.168.10.1.domain > 192.168.10.158.43636: 31059 8/0/0 CNAME phinf.pstatic.net.nheos.com., CNAME phinf.pstatic.net.e.navercdn.com., A 182.162.92.139, A 182.162.92.140, A 182.162.92.141, A 182.162.92.142, A 182.162.92.137, A 182.162.92.138 (215)
21:41:15.760668 IP 192.168.10.158.60418 > 182.162.92.139.https: Flags [S], seq 37395303, win 29200, options [mss 1460,sackOK,TS val 3520401 ecr 0,nop,wscale 7], length 0
21:41:15.760693 IP 192.168.10.158.60420 > 182.162.92.139.https: Flags [S], seq 3900543923, win 29200, options [mss 1460,sackOK,TS val 3520401 ecr 0,nop,wscale 7], length 0
21:41:15.760704 IP 192.168.10.158.60422 > 182.162.92.139.https: Flags [S], seq 3230174051, win 29200, options [mss 1460,sackOK,TS val 3520401 ecr 0,nop,wscale 7], length 0
21:41:15.760715 IP 192.168.10.158.60424 > 182.162.92.139.https: Flags [S], seq 2489383379, win 29200, options [mss 1460,sackOK,TS val 3520401 ecr 0,nop,wscale 7], length 0
21:41:15.765652 IP 182.162.92.42.https > 192.168.10.158.47696: Flags [.], seq 197222:198670, ack 1653, win 184, options [nop,nop,TS val 2143351424 ecr 3520400], length 1448
21:41:15.766562 IP 182.162.92.42.https > 192.168.10.158.47696: Flags [P.], seq 198670:199531, ack 1653, win 184, options [nop,nop,TS val 2143351424 ecr 3520400], length 861
21:41:15.766578 IP 192.168.10.158.47696 > 182.162.92.42.https: Flags [.], ack 199531, win 2674, options [nop,nop,TS val 3520402 ecr 2143351424], length 0
21:41:15.767518 IP 182.162.92.42.https > 192.168.10.158.47696: Flags [P.], seq 199531:203879, ack 1755, win 184, options [nop,nop,TS val 2143351425 ecr 3520400], length 4348
21:41:15.767538 IP 192.168.10.158.47696 > 182.162.92.42.https: Flags [.], ack 203879, win 2674, options [nop,nop,TS val 3520402 ecr 2143351425], length 0
21:41:15.768299 IP 192.168.10.158.47696 > 182.162.92.42.https: Flags [P.], seq 2162:2249, ack 203879, win 2674, options [nop,nop,TS val 3520402 ecr 2143351425], length 87
21:41:15.768682 IP 182.162.92.139.https > 192.168.10.158.60418: Flags [S.], seq 2066235249, ack 37395304, win 14480, options [mss 1460,sackOK,TS val 2138559331 ecr 3520401,nop,wscale 7], length 0
21:41:15.768696 IP 192.168.10.158.60418 > 182.162.92.139.https: Flags [.], ack 1, win 229, options [nop,nop,TS val 3520403 ecr 2138559331], length 0
21:41:15.768706 IP 182.162.92.42.https > 192.168.10.158.47696: Flags [P.], seq 203879:206421, ack 2162, win 196, options [nop,nop,TS val 2143351426 ecr 3520400], length 2542
21:41:15.768711 IP 192.168.10.158.47696 > 182.162.92.42.https: Flags [P.], seq 2249:2346, ack 206421, win 2674, options [nop,nop,TS val 3520403 ecr 2143351426], length 97
21:41:15.768717 IP 182.162.92.42.https > 192.168.10.158.47696: Flags [P.], seq 206421:210571, ack 2162, win 196, options [nop,nop,TS val 2143351426 ecr 3520400], length 4150
21:41:15.768770 IP 192.168.10.158.60418 > 182.162.92.139.https: Flags [P.], seq 1:206, ack 1, win 229, options [nop,nop,TS val 3520403 ecr 2138559331], length 205
21:41:15.768793 IP 192.168.10.158.47696 > 182.162.92.42.https: Flags [.], ack 210571, win 2674, options [nop,nop,TS val 3520403 ecr 2143351426], length 0
21:41:15.769917 IP 192.168.10.158.47696 > 182.162.92.42.https: Flags [P.], seq 2346:2430, ack 210571, win 2674, options [nop,nop,TS val 3520403 ecr 2143351426], length 84
21:41:15.770051 IP 182.162.92.42.https > 192.168.10.158.47696: Flags [P.], seq 210571:215508, ack 2162, win 196, options [nop,nop,TS val 2143351426 ecr 3520400], length 4937
21:41:15.770060 IP 182.162.92.42.https > 192.168.10.158.47696: Flags [P.], seq 215508:217596, ack 2162, win 196, options [nop,nop,TS val 2143351426 ecr 3520400], length 2088
21:41:15.770062 IP 182.162.92.139.https > 192.168.10.158.60422: Flags [S.], seq 3180972449, ack 3230174052, win 14480, options [mss 1460,sackOK,TS val 2138559331 ecr 3520401,nop,wscale 7], length 0
21:41:15.770069 IP 192.168.10.158.60422 > 182.162.92.139.https: Flags [.], ack 1, win 229, options [nop,nop,TS val 3520403 ecr 2138559331], length 0
21:41:15.770074 IP 192.168.10.158.47696 > 182.162.92.42.https: Flags [.], ack 217596, win 2674, options [nop,nop,TS val 3520403 ecr 2143351426], length 0
21:41:15.770353 IP 192.168.10.158.47696 > 182.162.92.42.https: Flags [P.], seq 2430:2518, ack 217596, win 2674, options [nop,nop,TS val 3520403 ecr 2143351426], length 88
21:41:15.771039 IP 192.168.10.158.60426 > 182.162.92.139.https: Flags [S], seq 3806716964, win 29200, options [mss 1460,sackOK,TS val 3520403 ecr 0,nop,wscale 7], length 0
21:41:15.771161 IP 192.168.10.1.domain > 192.168.10.158.43636: 7434 NXDomain 0/1/0 (103)
21:41:15.771169 IP 192.168.10.158.60428 > 182.162.92.139.https: Flags [S], seq 2867950383, win 29200, options [mss 1460,sackOK,TS val 3520403 ecr 0,nop,wscale 7], length 0
21:41:15.771169 IP 182.162.92.139.https > 192.168.10.158.60424: Flags [S.], seq 665401368, ack 2489383380, win 14480, options [mss 1460,sackOK,TS val 2138559332 ecr 3520401,nop,wscale 7], length 0
21:41:15.771176 IP 192.168.10.158.60424 > 182.162.92.139.https: Flags [.], ack 1, win 229, options [nop,nop,TS val 3520403 ecr 2138559332], length 0
21:41:15.771181 IP 182.162.92.139.https > 192.168.10.158.60420: Flags [S.], seq 1854054601, ack 3900543924, win 14480, options [mss 1460,sackOK,TS val 2138559331 ecr 3520401,nop,wscale 7], length 0
21:41:15.771184 IP 192.168.10.158.60420 > 182.162.92.139.https: Flags [.], ack 1, win 229, options [nop,nop,TS val 3520403 ecr 2138559331], length 0
21:41:15.771247 IP 192.168.10.158.60422 > 182.162.92.139.https: Flags [P.], seq 1:206, ack 1, win 229, options [nop,nop,TS val 3520403 ecr 2138559331], length 205
21:41:15.771295 IP 192.168.10.158.60424 > 182.162.92.139.https: Flags [P.], seq 1:206, ack 1, win 229, options [nop,nop,TS val 3520403 ecr 2138559332], length 205
21:41:15.771339 IP 192.168.10.158.60420 > 182.162.92.139.https: Flags [P.], seq 1:206, ack 1, win 229, options [nop,nop,TS val 3520403 ecr 2138559331], length 205
21:41:15.775716 IP 182.162.92.42.https > 192.168.10.158.47696: Flags [.], ack 2346, win 196, options [nop,nop,TS val 2143351435 ecr 3520402], length 0
21:41:15.776275 IP 182.162.92.42.https > 192.168.10.158.47696: Flags [P.], seq 217596:218692, ack 2346, win 196, options [nop,nop,TS val 2143351435 ecr 3520402], length 1096
21:41:15.776907 IP 192.168.10.158.47696 > 182.162.92.42.https: Flags [P.], seq 2518:2608, ack 218692, win 2674, options [nop,nop,TS val 3520405 ecr 2143351435], length 90
21:41:15.776988 IP 182.162.92.42.https > 192.168.10.158.47696: Flags [P.], seq 218692:219048, ack 2346, win 196, options [nop,nop,TS val 2143351435 ecr 3520402], length 356
21:41:15.777003 IP 182.162.92.139.https > 192.168.10.158.60418: Flags [.], seq 1:1449, ack 206, win 122, options [nop,nop,TS val 2138559340 ecr 3520403], length 1448
21:41:15.777011 IP 192.168.10.158.60418 > 182.162.92.139.https: Flags [.], ack 1449, win 251, options [nop,nop,TS val 3520405 ecr 2138559340], length 0
21:41:15.777530 IP 182.162.92.42.https > 192.168.10.158.47696: Flags [P.], seq 219048:219086, ack 2346, win 196, options [nop,nop,TS val 2143351435 ecr 3520402], length 38
21:41:15.777544 IP 192.168.10.158.47696 > 182.162.92.42.https: Flags [.], ack 219086, win 2674, options [nop,nop,TS val 3520405 ecr 2143351435], length 0
21:41:15.778240 IP 192.168.10.158.47696 > 182.162.92.42.https: Flags [P.], seq 2608:2696, ack 219086, win 2674, options [nop,nop,TS val 3520405 ecr 2143351435], length 88
21:41:15.778294 IP 182.162.92.42.https > 192.168.10.158.47696: Flags [P.], seq 219086:219890, ack 2430, win 196, options [nop,nop,TS val 2143351436 ecr 3520403], length 804
21:41:15.778309 IP 182.162.92.139.https > 192.168.10.158.60426: Flags [S.], seq 2672504728, ack 3806716965, win 14480, options [mss 1460,sackOK,TS val 2138559341 ecr 3520403,nop,wscale 7], length 0
21:41:15.778319 IP 192.168.10.158.60426 > 182.162.92.139.https: Flags [.], ack 1, win 229, options [nop,nop,TS val 3520405 ecr 2138559341], length 0
21:41:15.779084 IP 192.168.10.158.60426 > 182.162.92.139.https: Flags [P.], seq 1:206, ack 1, win 229, options [nop,nop,TS val 3520405 ecr 2138559341], length 205
21:41:15.779163 IP 192.168.10.158.43636 > 192.168.10.1.domain: 11202+ A? search.pstatic.net. (36)
21:41:15.779485 IP 192.168.10.158.47696 > 182.162.92.42.https: Flags [P.], seq 2696:2832, ack 219890, win 2674, options [nop,nop,TS val 3520405 ecr 2143351436], length 136
21:41:15.780140 IP 182.162.92.139.https > 192.168.10.158.60418: Flags [.], seq 1449:2897, ack 206, win 122, options [nop,nop,TS val 2138559340 ecr 3520403], length 1448
21:41:15.780152 IP 192.168.10.158.60418 > 182.162.92.139.https: Flags [.], ack 2897, win 274, options [nop,nop,TS val 3520405 ecr 2138559340], length 0
21:41:15.780774 IP 192.168.10.158.47696 > 182.162.92.42.https: Flags [P.], seq 2832:2924, ack 219890, win 2674, options [nop,nop,TS val 3520406 ecr 2143351436], length 92
21:41:15.783390 IP 182.162.92.139.https > 192.168.10.158.60418: Flags [P.], seq 2897:3650, ack 206, win 122, options [nop,nop,TS val 2138559340 ecr 3520403], length 753
21:41:15.783433 IP 192.168.10.158.60418 > 182.162.92.139.https: Flags [.], ack 3650, win 296, options [nop,nop,TS val 3520406 ecr 2138559340], length 0
21:41:15.783467 IP 182.162.92.42.https > 192.168.10.158.47696: Flags [P.], seq 219890:220248, ack 2518, win 196, options [nop,nop,TS val 2143351437 ecr 3520403], length 358
21:41:15.783485 IP 182.162.92.139.https > 192.168.10.158.60428: Flags [S.], seq 462503109, ack 2867950384, win 14480, options [mss 1460,sackOK,TS val 2138559342 ecr 3520403,nop,wscale 7], length 0
21:41:15.783506 IP 192.168.10.158.60428 > 182.162.92.139.https: Flags [.], ack 1, win 229, options [nop,nop,TS val 3520406 ecr 2138559342], length 0
21:41:15.783523 IP 182.162.92.139.https > 192.168.10.158.60422: Flags [.], seq 1:1449, ack 206, win 122, options [nop,nop,TS val 2138559342 ecr 3520403], length 1448
21:41:15.783529 IP 192.168.10.158.60422 > 182.162.92.139.https: Flags [.], ack 1449, win 251, options [nop,nop,TS val 3520406 ecr 2138559342], length 0
21:41:15.783533 IP 182.162.92.139.https > 192.168.10.158.60420: Flags [.], seq 1:1449, ack 206, win 122, options [nop,nop,TS val 2138559342 ecr 3520403], length 1448
21:41:15.783537 IP 192.168.10.158.60420 > 182.162.92.139.https: Flags [.], ack 1449, win 251, options [nop,nop,TS val 3520406 ecr 2138559342], length 0
21:41:15.784414 IP 192.168.10.158.60418 > 182.162.92.139.https: Flags [P.], seq 206:332, ack 3650, win 296, options [nop,nop,TS val 3520406 ecr 2138559340], length 126
21:41:15.785220 IP 192.168.10.158.60428 > 182.162.92.139.https: Flags [P.], seq 1:206, ack 1, win 229, options [nop,nop,TS val 3520407 ecr 2138559342], length 205
21:41:15.785283 IP 182.162.92.139.https > 192.168.10.158.60420: Flags [P.], seq 1449:3650, ack 206, win 122, options [nop,nop,TS val 2138559342 ecr 3520403], length 2201
21:41:15.785294 IP 192.168.10.158.60420 > 182.162.92.139.https: Flags [.], ack 3650, win 286, options [nop,nop,TS val 3520407 ecr 2138559342], length 0
21:41:15.785310 IP 182.162.92.139.https > 192.168.10.158.60422: Flags [.], seq 1449:2897, ack 206, win 122, options [nop,nop,TS val 2138559342 ecr 3520403], length 1448
21:41:15.785314 IP 192.168.10.158.60422 > 182.162.92.139.https: Flags [.], ack 2897, win 274, options [nop,nop,TS val 3520407 ecr 2138559342], length 0
21:41:15.785318 IP 182.162.92.139.https > 192.168.10.158.60424: Flags [.], seq 1:1449, ack 206, win 122, options [nop,nop,TS val 2138559343 ecr 3520403], length 1448
21:41:15.785324 IP 192.168.10.158.60424 > 182.162.92.139.https: Flags [.], ack 1449, win 251, options [nop,nop,TS val 3520407 ecr 2138559343], length 0
21:41:15.785814 IP 192.168.10.158.60420 > 182.162.92.139.https: Flags [P.], seq 206:332, ack 3650, win 286, options [nop,nop,TS val 3520407 ecr 2138559342], length 126
21:41:15.785942 IP 192.168.10.158.47696 > 182.162.92.42.https: Flags [P.], seq 2924:3021, ack 220248, win 2674, options [nop,nop,TS val 3520407 ecr 2143351437], length 97
21:41:15.786246 IP 192.168.10.158.60420 > 182.162.92.139.https: Flags [F.], seq 332, ack 3650, win 286, options [nop,nop,TS val 3520407 ecr 2138559342], length 0
21:41:15.786309 IP 192.168.10.158.60418 > 182.162.92.139.https: Flags [P.], seq 332:385, ack 3650, win 296, options [nop,nop,TS val 3520407 ecr 2138559340], length 53
21:41:15.787546 IP 192.168.10.158.60418 > 182.162.92.139.https: Flags [P.], seq 385:1278, ack 3650, win 296, options [nop,nop,TS val 3520407 ecr 2138559340], length 893
21:41:15.790478 IP 192.168.10.1.domain > 192.168.10.158.43636: 11202 10/0/0 CNAME search.pstatic.net.nheos.com., CNAME search.pstatic.net.e.navercdn.com., A 182.162.92.143, A 182.162.92.144, A 182.162.92.145, A 182.162.92.146, A 182.162.92.147, A 182.162.92.148, A 182.162.92.149, A 182.162.92.150 (250)
21:41:15.790493 IP 182.162.92.139.https > 192.168.10.158.60422: Flags [P.], seq 2897:3650, ack 206, win 122, options [nop,nop,TS val 2138559342 ecr 3520403], length 753
21:41:15.790503 IP 192.168.10.158.60422 > 182.162.92.139.https: Flags [.], ack 3650, win 296, options [nop,nop,TS val 3520408 ecr 2138559342], length 0
21:41:15.790519 IP 182.162.92.139.https > 192.168.10.158.60424: Flags [P.], seq 1449:3651, ack 206, win 122, options [nop,nop,TS val 2138559343 ecr 3520403], length 2202
21:41:15.790521 IP 192.168.10.158.60424 > 182.162.92.139.https: Flags [.], ack 3651, win 286, options [nop,nop,TS val 3520408 ecr 2138559343], length 0
21:41:15.790525 IP 182.162.92.42.https > 192.168.10.158.47696: Flags [P.], seq 220248:221330, ack 2608, win 196, options [nop,nop,TS val 2143351443 ecr 3520405], length 1082
21:41:15.790541 IP 182.162.92.42.https > 192.168.10.158.47696: Flags [P.], seq 221330:234222, ack 2696, win 196, options [nop,nop,TS val 2143351444 ecr 3520405], length 12892
21:41:15.791068 IP 192.168.10.158.60422 > 182.162.92.139.https: Flags [P.], seq 206:332, ack 3650, win 296, options [nop,nop,TS val 3520408 ecr 2138559342], length 126
21:41:15.791275 IP 192.168.10.158.44944 > 182.162.92.143.https: Flags [S], seq 2638901518, win 29200, options [mss 1460,sackOK,TS val 3520408 ecr 0,nop,wscale 7], length 0
21:41:15.791499 IP 182.162.92.139.https > 192.168.10.158.60426: Flags [P.], seq 1:3651, ack 206, win 122, options [nop,nop,TS val 2138559350 ecr 3520405], length 3650
21:41:15.791506 IP 192.168.10.158.60426 > 182.162.92.139.https: Flags [.], ack 3651, win 286, options [nop,nop,TS val 3520408 ecr 2138559350], length 0
21:41:15.791511 IP 182.162.92.42.https > 192.168.10.158.47696: Flags [P.], seq 234222:234553, ack 2832, win 208, options [nop,nop,TS val 2143351447 ecr 3520405], length 331
21:41:15.791517 IP 182.162.92.42.https > 192.168.10.158.47696: Flags [.], seq 234553:236001, ack 2924, win 208, options [nop,nop,TS val 2143351448 ecr 3520406], length 1448
21:41:15.791696 IP 192.168.10.158.60424 > 182.162.92.139.https: Flags [P.], seq 206:332, ack 3651, win 286, options [nop,nop,TS val 3520408 ecr 2138559343], length 126
21:41:15.791821 IP 192.168.10.158.47696 > 182.162.92.42.https: Flags [.], ack 236001, win 2674, options [nop,nop,TS val 3520408 ecr 2143351443], length 0
21:41:15.793183 IP 192.168.10.158.60426 > 182.162.92.139.https: Flags [P.], seq 206:332, ack 3651, win 286, options [nop,nop,TS val 3520409 ecr 2138559350], length 126
21:41:15.793561 IP 192.168.10.158.47696 > 182.162.92.42.https: Flags [P.], seq 3021:3117, ack 236001, win 2674, options [nop,nop,TS val 3520409 ecr 2143351443], length 96
21:41:15.793962 IP 192.168.10.158.47696 > 182.162.92.42.https: Flags [P.], seq 3117:3215, ack 236001, win 2674, options [nop,nop,TS val 3520409 ecr 2143351443], length 98
21:41:15.799248 IP 182.162.92.42.https > 192.168.10.158.47696: Flags [P.], seq 236001:243608, ack 2924, win 208, options [nop,nop,TS val 2143351448 ecr 3520406], length 7607
21:41:15.799300 IP 182.162.92.139.https > 192.168.10.158.60418: Flags [P.], seq 3650:3908, ack 332, win 122, options [nop,nop,TS val 2138559356 ecr 3520406], length 258
21:41:15.799320 IP 182.162.92.139.https > 192.168.10.158.60420: Flags [P.], seq 3650:3908, ack 332, win 122, options [nop,nop,TS val 2138559356 ecr 3520407], length 258
21:41:15.799363 IP 192.168.10.158.60420 > 182.162.92.139.https: Flags [R], seq 3900544255, win 0, length 0
21:41:15.799399 IP 182.162.92.139.https > 192.168.10.158.60418: Flags [P.], seq 3908:3977, ack 332, win 122, options [nop,nop,TS val 2138559356 ecr 3520406], length 69
21:41:15.799494 IP 192.168.10.158.47696 > 182.162.92.42.https: Flags [.], ack 243608, win 2674, options [nop,nop,TS val 3520410 ecr 2143351448], length 0
21:41:15.800782 IP 192.168.10.158.60418 > 182.162.92.139.https: Flags [.], ack 3977, win 319, options [nop,nop,TS val 3520411 ecr 2138559356], length 0
21:41:15.801297 IP 192.168.10.158.60418 > 182.162.92.139.https: Flags [P.], seq 1278:1316, ack 3977, win 319, options [nop,nop,TS val 3520411 ecr 2138559356], length 38
21:41:15.805844 IP 192.168.10.158.47696 > 182.162.92.42.https: Flags [P.], seq 3215:3304, ack 243608, win 2674, options [nop,nop,TS val 3520412 ecr 2143351448], length 89
21:41:15.811407 IP 182.162.92.139.https > 192.168.10.158.60420: Flags [P.], seq 3908:3977, ack 332, win 122, options [nop,nop,TS val 2138559356 ecr 3520407], length 69
21:41:15.811461 IP 192.168.10.158.60420 > 182.162.92.139.https: Flags [R], seq 3900544255, win 0, length 0
21:41:15.811482 IP 182.162.92.42.https > 192.168.10.158.47696: Flags [P.], seq 243608:243987, ack 3021, win 208, options [nop,nop,TS val 2143351452 ecr 3520407], length 379
21:41:15.811496 IP 182.162.92.139.https > 192.168.10.158.60428: Flags [P.], seq 1:3650, ack 206, win 122, options [nop,nop,TS val 2138559355 ecr 3520407], length 3649
21:41:15.811502 IP 192.168.10.158.60428 > 182.162.92.139.https: Flags [.], ack 3650, win 286, options [nop,nop,TS val 3520413 ecr 2138559355], length 0
21:41:15.811504 IP 182.162.92.139.https > 192.168.10.158.60420: Flags [P.], seq 3977:4008, ack 333, win 122, options [nop,nop,TS val 2138559357 ecr 3520407], length 31
21:41:15.811506 IP 192.168.10.158.60420 > 182.162.92.139.https: Flags [R], seq 3900544256, win 0, length 0
21:41:15.811508 IP 182.162.92.139.https > 192.168.10.158.60420: Flags [F.], seq 4008, ack 333, win 122, options [nop,nop,TS val 2138559357 ecr 3520407], length 0
21:41:15.811510 IP 192.168.10.158.60420 > 182.162.92.139.https: Flags [R], seq 3900544256, win 0, length 0
21:41:15.812646 IP 192.168.10.158.60428 > 182.162.92.139.https: Flags [P.], seq 206:332, ack 3650, win 286, options [nop,nop,TS val 3520414 ecr 2138559355], length 126
21:41:15.813161 IP 192.168.10.158.47696 > 182.162.92.42.https: Flags [P.], seq 3304:3404, ack 243987, win 2674, options [nop,nop,TS val 3520414 ecr 2143351452], length 100
21:41:15.817719 IP 182.162.92.139.https > 192.168.10.158.60418: Flags [.], ack 1278, win 136, options [nop,nop,TS val 2138559359 ecr 3520407], length 0
21:41:15.817733 IP 182.162.92.139.https > 192.168.10.158.60418: Flags [P.], seq 3977:4015, ack 1278, win 136, options [nop,nop,TS val 2138559359 ecr 3520407], length 38
21:41:15.817740 IP 182.162.92.139.https > 192.168.10.158.60418: Flags [.], seq 4015:6911, ack 1278, win 136, options [nop,nop,TS val 2138559359 ecr 3520407], length 2896
21:41:15.817748 IP 192.168.10.158.60418 > 182.162.92.139.https: Flags [.], ack 6911, win 364, options [nop,nop,TS val 3520415 ecr 2138559359], length 0
21:41:15.817796 IP 182.162.92.139.https > 192.168.10.158.60418: Flags [P.], seq 6911:8683, ack 1278, win 136, options [nop,nop,TS val 2138559359 ecr 3520407], length 1772
21:41:15.817799 IP 192.168.10.158.60418 > 182.162.92.139.https: Flags [.], ack 8683, win 392, options [nop,nop,TS val 3520415 ecr 2138559359], length 0
21:41:15.817803 IP 182.162.92.139.https > 192.168.10.158.60418: Flags [.], seq 8683:10131, ack 1278, win 136, options [nop,nop,TS val 2138559359 ecr 3520407], length 1448
21:41:15.824925 IP 182.162.92.139.https > 192.168.10.158.60418: Flags [P.], seq 10131:12431, ack 1278, win 136, options [nop,nop,TS val 2138559359 ecr 3520407], length 2300
21:41:15.824945 IP 192.168.10.158.60418 > 182.162.92.139.https: Flags [.], ack 12431, win 451, options [nop,nop,TS val 3520417 ecr 2138559359], length 0
21:41:15.824959 IP 182.162.92.139.https > 192.168.10.158.60422: Flags [P.], seq 3650:3908, ack 332, win 122, options [nop,nop,TS val 2138559362 ecr 3520408], length 258
21:41:15.824965 IP 182.162.92.139.https > 192.168.10.158.60422: Flags [P.], seq 3908:3977, ack 332, win 122, options [nop,nop,TS val 2138559362 ecr 3520408], length 69
21:41:15.824966 IP 182.162.92.143.https > 192.168.10.158.44944: Flags [S.], seq 895917616, ack 2638901519, win 14480, options [mss 1460,sackOK,TS val 2128956280 ecr 3520408,nop,wscale 7], length 0
21:41:15.824977 IP 192.168.10.158.44944 > 182.162.92.143.https: Flags [.], ack 1, win 229, options [nop,nop,TS val 3520417 ecr 2128956280], length 0
21:41:15.824980 IP 182.162.92.139.https > 192.168.10.158.60426: Flags [P.], seq 3651:3909, ack 332, win 122, options [nop,nop,TS val 2138559364 ecr 3520409], length 258
21:41:15.824984 IP 182.162.92.139.https > 192.168.10.158.60424: Flags [P.], seq 3651:3909, ack 332, win 122, options [nop,nop,TS val 2138559364 ecr 3520408], length 258
21:41:15.825802 IP 192.168.10.158.44946 > 182.162.92.143.https: Flags [S], seq 3876558115, win 29200, options [mss 1460,sackOK,TS val 3520417 ecr 0,nop,wscale 7], length 0
21:41:15.825952 IP 192.168.10.158.44948 > 182.162.92.143.https: Flags [S], seq 1619467270, win 29200, options [mss 1460,sackOK,TS val 3520417 ecr 0,nop,wscale 7], length 0
21:41:15.826008 IP 192.168.10.158.44944 > 182.162.92.143.https: Flags [P.], seq 1:207, ack 1, win 229, options [nop,nop,TS val 3520417 ecr 2128956280], length 206
21:41:15.830809 IP 182.162.92.42.https > 192.168.10.158.47696: Flags [.], ack 3215, win 208, options [nop,nop,TS val 2143351460 ecr 3520409], length 0
21:41:15.830824 IP 182.162.92.139.https > 192.168.10.158.60426: Flags [P.], seq 3909:3978, ack 332, win 122, options [nop,nop,TS val 2138559364 ecr 3520409], length 69
21:41:15.830828 IP 182.162.92.139.https > 192.168.10.158.60424: Flags [P.], seq 3909:3978, ack 332, win 122, options [nop,nop,TS val 2138559364 ecr 3520408], length 69
21:41:15.830833 IP 182.162.92.42.https > 192.168.10.158.47696: Flags [P.], seq 243987:244690, ack 3215, win 208, options [nop,nop,TS val 2143351460 ecr 3520409], length 703
21:41:15.830838 IP 182.162.92.42.https > 192.168.10.158.47696: Flags [P.], seq 244690:245402, ack 3215, win 208, options [nop,nop,TS val 2143351461 ecr 3520409], length 712
21:41:15.830849 IP 182.162.92.139.https > 192.168.10.158.60418: Flags [.], seq 12431:15327, ack 1278, win 136, options [nop,nop,TS val 2138559370 ecr 3520411], length 2896
21:41:15.830855 IP 192.168.10.158.60418 > 182.162.92.139.https: Flags [.], ack 15327, win 496, options [nop,nop,TS val 3520418 ecr 2138559370], length 0
21:41:15.830880 IP 192.168.10.158.47696 > 182.162.92.42.https: Flags [.], ack 245402, win 2674, options [nop,nop,TS val 3520418 ecr 2143351460], length 0
21:41:15.832346 IP 192.168.10.158.44950 > 182.162.92.143.https: Flags [S], seq 2881993383, win 29200, options [mss 1460,sackOK,TS val 3520418 ecr 0,nop,wscale 7], length 0
21:41:15.833366 IP 192.168.10.158.47696 > 182.162.92.42.https: Flags [P.], seq 3404:3484, ack 245402, win 2674, options [nop,nop,TS val 3520419 ecr 2143351460], length 80
21:41:15.839205 IP 182.162.92.42.https > 192.168.10.158.47696: Flags [.], seq 245402:246850, ack 3304, win 208, options [nop,nop,TS val 2143351474 ecr 3520412], length 1448
21:41:15.851955 IP 182.162.92.42.https > 192.168.10.158.47696: Flags [P.], seq 246850:248128, ack 3304, win 208, options [nop,nop,TS val 2143351474 ecr 3520412], length 1278
21:41:15.851969 IP 192.168.10.158.47696 > 182.162.92.42.https: Flags [.], ack 248128, win 2674, options [nop,nop,TS val 3520423 ecr 2143351474], length 0
21:41:15.851983 IP 182.162.92.139.https > 192.168.10.158.60428: Flags [P.], seq 3650:3908, ack 332, win 122, options [nop,nop,TS val 2138559382 ecr 3520414], length 258
21:41:15.851987 IP 182.162.92.139.https > 192.168.10.158.60428: Flags [P.], seq 3908:3977, ack 332, win 122, options [nop,nop,TS val 2138559382 ecr 3520414], length 69
21:41:15.851989 IP 182.162.92.42.https > 192.168.10.158.47696: Flags [P.], seq 248128:248465, ack 3404, win 208, options [nop,nop,TS val 2143351479 ecr 3520414], length 337
21:41:15.851995 IP 182.162.92.139.https > 192.168.10.158.60418: Flags [P.], seq 15327:18223, ack 1316, win 136, options [nop,nop,TS val 2138559388 ecr 3520411], length 2896
21:41:15.851998 IP 192.168.10.158.60418 > 182.162.92.139.https: Flags [.], ack 18223, win 541, options [nop,nop,TS val 3520423 ecr 2138559388], length 0
21:41:15.852004 IP 182.162.92.139.https > 192.168.10.158.60418: Flags [.], seq 18223:21119, ack 1316, win 136, options [nop,nop,TS val 2138559388 ecr 3520411], length 2896
21:41:15.852006 IP 192.168.10.158.60418 > 182.162.92.139.https: Flags [.], ack 21119, win 586, options [nop,nop,TS val 3520423 ecr 2138559388], length 0
21:41:15.852011 IP 182.162.92.139.https > 192.168.10.158.60418: Flags [.], seq 21119:26911, ack 1316, win 136, options [nop,nop,TS val 2138559388 ecr 3520415], length 5792
21:41:15.852013 IP 192.168.10.158.60418 > 182.162.92.139.https: Flags [.], ack 26911, win 677, options [nop,nop,TS val 3520423 ecr 2138559388], length 0
21:41:15.852016 IP 182.162.92.143.https > 192.168.10.158.44946: Flags [S.], seq 4207874497, ack 3876558116, win 14480, options [mss 1460,sackOK,TS val 2128956314 ecr 3520417,nop,wscale 7], length 0
21:41:15.852022 IP 192.168.10.158.44946 > 182.162.92.143.https: Flags [.], ack 1, win 229, options [nop,nop,TS val 3520423 ecr 2128956314], length 0
21:41:15.852028 IP 182.162.92.139.https > 192.168.10.158.60418: Flags [.], seq 26911:31255, ack 1316, win 136, options [nop,nop,TS val 2138559397 ecr 3520417], length 4344
21:41:15.852031 IP 192.168.10.158.60418 > 182.162.92.139.https: Flags [.], ack 31255, win 745, options [nop,nop,TS val 3520423 ecr 2138559397], length 0
21:41:15.854235 IP 192.168.10.158.44952 > 182.162.92.143.https: Flags [S], seq 1999833997, win 29200, options [mss 1460,sackOK,TS val 3520424 ecr 0,nop,wscale 7], length 0
21:41:15.854350 IP 192.168.10.158.44954 > 182.162.92.143.https: Flags [S], seq 1680645074, win 29200, options [mss 1460,sackOK,TS val 3520424 ecr 0,nop,wscale 7], length 0
21:41:15.854366 IP 182.162.92.143.https > 192.168.10.158.44948: Flags [S.], seq 3196838197, ack 1619467271, win 14480, options [mss 1460,sackOK,TS val 2128956315 ecr 3520417,nop,wscale 7], length 0
21:41:15.854381 IP 192.168.10.158.44948 > 182.162.92.143.https: Flags [.], ack 1, win 229, options [nop,nop,TS val 3520424 ecr 2128956315], length 0
21:41:15.854390 IP 182.162.92.139.https > 192.168.10.158.60418: Flags [.], seq 31255:32703, ack 1316, win 136, options [nop,nop,TS val 2138559397 ecr 3520417], length 1448
21:41:15.854394 IP 182.162.92.143.https > 192.168.10.158.44944: Flags [.], seq 1:2897, ack 207, win 122, options [nop,nop,TS val 2128956316 ecr 3520417], length 2896
21:41:15.854400 IP 192.168.10.158.44944 > 182.162.92.143.https: Flags [.], ack 2897, win 274, options [nop,nop,TS val 3520424 ecr 2128956316], length 0
21:41:15.854525 IP 192.168.10.158.44946 > 182.162.92.143.https: Flags [P.], seq 1:207, ack 1, win 229, options [nop,nop,TS val 3520424 ecr 2128956314], length 206
21:41:15.854647 IP 192.168.10.158.44948 > 182.162.92.143.https: Flags [P.], seq 1:207, ack 1, win 229, options [nop,nop,TS val 3520424 ecr 2128956315], length 206
21:41:15.854678 IP 192.168.10.158.47696 > 182.162.92.42.https: Flags [P.], seq 3484:3569, ack 248465, win 2674, options [nop,nop,TS val 3520424 ecr 2143351479], length 85
21:41:15.859858 IP 182.162.92.143.https > 192.168.10.158.44944: Flags [P.], seq 2897:3652, ack 207, win 122, options [nop,nop,TS val 2128956316 ecr 3520417], length 755
21:41:15.859891 IP 192.168.10.158.44944 > 182.162.92.143.https: Flags [.], ack 3652, win 296, options [nop,nop,TS val 3520425 ecr 2128956316], length 0
21:41:15.859910 IP 182.162.92.143.https > 192.168.10.158.44950: Flags [S.], seq 3769798767, ack 2881993384, win 14480, options [mss 1460,sackOK,TS val 2128956322 ecr 3520418,nop,wscale 7], length 0
21:41:15.859923 IP 192.168.10.158.44950 > 182.162.92.143.https: Flags [.], ack 1, win 229, options [nop,nop,TS val 3520425 ecr 2128956322], length 0
21:41:15.859926 IP 182.162.92.139.https > 192.168.10.158.60418: Flags [.], seq 32703:34151, ack 1316, win 136, options [nop,nop,TS val 2138559405 ecr 3520418], length 1448
21:41:15.859929 IP 192.168.10.158.60418 > 182.162.92.139.https: Flags [.], ack 34151, win 790, options [nop,nop,TS val 3520425 ecr 2138559397], length 0
21:41:15.859951 IP 182.162.92.42.https > 192.168.10.158.47696: Flags [P.], seq 248465:248957, ack 3484, win 208, options [nop,nop,TS val 2143351501 ecr 3520419], length 492
21:41:15.859955 IP 182.162.92.139.https > 192.168.10.158.60418: Flags [.], seq 34151:35599, ack 1316, win 136, options [nop,nop,TS val 2138559405 ecr 3520418], length 1448
21:41:15.860570 IP 182.162.92.139.https > 192.168.10.158.60418: Flags [P.], seq 35599:37706, ack 1316, win 136, options [nop,nop,TS val 2138559422 ecr 3520423], length 2107
21:41:15.860577 IP 192.168.10.158.60418 > 182.162.92.139.https: Flags [.], ack 37706, win 846, options [nop,nop,TS val 3520426 ecr 2138559405], length 0
21:41:15.860846 IP 192.168.10.158.44944 > 182.162.92.143.https: Flags [P.], seq 207:333, ack 3652, win 296, options [nop,nop,TS val 3520426 ecr 2128956316], length 126
21:41:15.861571 IP 182.162.92.143.https > 192.168.10.158.44954: Flags [S.], seq 4123922756, ack 1680645075, win 14480, options [mss 1460,sackOK,TS val 2128956342 ecr 3520424,nop,wscale 7], length 0
21:41:15.861598 IP 192.168.10.158.44954 > 182.162.92.143.https: Flags [.], ack 1, win 229, options [nop,nop,TS val 3520426 ecr 2128956342], length 0
21:41:15.862322 IP 182.162.92.143.https > 192.168.10.158.44952: Flags [S.], seq 4003269509, ack 1999833998, win 14480, options [mss 1460,sackOK,TS val 2128956342 ecr 3520424,nop,wscale 7], length 0
21:41:15.862345 IP 192.168.10.158.44952 > 182.162.92.143.https: Flags [.], ack 1, win 229, options [nop,nop,TS val 3520426 ecr 2128956342], length 0
21:41:15.863363 IP 192.168.10.158.44950 > 182.162.92.143.https: Flags [P.], seq 1:207, ack 1, win 229, options [nop,nop,TS val 3520426 ecr 2128956322], length 206
21:41:15.864136 IP 192.168.10.158.44954 > 182.162.92.143.https: Flags [P.], seq 1:207, ack 1, win 229, options [nop,nop,TS val 3520426 ecr 2128956342], length 206
21:41:15.864190 IP 192.168.10.158.44952 > 182.162.92.143.https: Flags [P.], seq 1:207, ack 1, win 229, options [nop,nop,TS val 3520426 ecr 2128956342], length 206
21:41:15.864617 IP 192.168.10.158.47696 > 182.162.92.42.https: Flags [P.], seq 3569:3651, ack 248957, win 2674, options [nop,nop,TS val 3520427 ecr 2143351501], length 82
21:41:15.864903 IP 192.168.10.158.44944 > 182.162.92.143.https: Flags [P.], seq 333:386, ack 3652, win 296, options [nop,nop,TS val 3520427 ecr 2128956316], length 53
21:41:15.864968 IP 192.168.10.158.47696 > 182.162.92.42.https: Flags [P.], seq 3651:3818, ack 248957, win 2674, options [nop,nop,TS val 3520427 ecr 2143351501], length 167
21:41:15.865394 IP 192.168.10.158.44944 > 182.162.92.143.https: Flags [P.], seq 386:484, ack 3652, win 296, options [nop,nop,TS val 3520427 ecr 2128956316], length 98
21:41:15.865797 IP 192.168.10.158.47696 > 182.162.92.42.https: Flags [P.], seq 3818:3906, ack 248957, win 2674, options [nop,nop,TS val 3520427 ecr 2143351501], length 88
21:41:15.867741 IP 192.168.10.158.44944 > 182.162.92.143.https: Flags [P.], seq 484:1906, ack 3652, win 296, options [nop,nop,TS val 3520427 ecr 2128956316], length 1422
21:41:15.868083 IP 182.162.92.143.https > 192.168.10.158.44946: Flags [.], seq 1:1449, ack 207, win 122, options [nop,nop,TS val 2128956349 ecr 3520424], length 1448
21:41:15.868149 IP 192.168.10.158.44946 > 182.162.92.143.https: Flags [.], ack 1449, win 251, options [nop,nop,TS val 3520427 ecr 2128956349], length 0
21:41:15.868811 IP 182.162.92.143.https > 192.168.10.158.44946: Flags [P.], seq 1449:3650, ack 207, win 122, options [nop,nop,TS val 2128956349 ecr 3520424], length 2201
21:41:15.868860 IP 192.168.10.158.44946 > 182.162.92.143.https: Flags [.], ack 3650, win 286, options [nop,nop,TS val 3520428 ecr 2128956349], length 0
21:41:15.869636 IP 192.168.10.158.44946 > 182.162.92.143.https: Flags [P.], seq 207:333, ack 3650, win 286, options [nop,nop,TS val 3520428 ecr 2128956349], length 126
21:41:15.869849 IP 182.162.92.143.https > 192.168.10.158.44948: Flags [P.], seq 1:3651, ack 207, win 122, options [nop,nop,TS val 2128956349 ecr 3520424], length 3650
21:41:15.869863 IP 192.168.10.158.44948 > 182.162.92.143.https: Flags [.], ack 3651, win 286, options [nop,nop,TS val 3520428 ecr 2128956349], length 0
21:41:15.869871 IP 182.162.92.143.https > 192.168.10.158.44944: Flags [P.], seq 3652:3910, ack 333, win 122, options [nop,nop,TS val 2128956349 ecr 3520426], length 258
21:41:15.869877 IP 182.162.92.143.https > 192.168.10.158.44944: Flags [P.], seq 3910:3979, ack 333, win 122, options [nop,nop,TS val 2128956350 ecr 3520426], length 69
21:41:15.869880 IP 182.162.92.42.https > 192.168.10.158.47696: Flags [P.], seq 248957:250398, ack 3569, win 208, options [nop,nop,TS val 2143351527 ecr 3520424], length 1441
21:41:15.870367 IP 192.168.10.158.44948 > 182.162.92.143.https: Flags [P.], seq 207:333, ack 3651, win 286, options [nop,nop,TS val 3520428 ecr 2128956349], length 126
21:41:15.870508 IP 192.168.10.158.44944 > 182.162.92.143.https: Flags [.], ack 3979, win 319, options [nop,nop,TS val 3520428 ecr 2128956349], length 0
21:41:15.870508 IP 182.162.92.143.https > 192.168.10.158.44950: Flags [.], seq 1:1449, ack 207, win 122, options [nop,nop,TS val 2128956351 ecr 3520426], length 1448
21:41:15.870515 IP 192.168.10.158.44950 > 182.162.92.143.https: Flags [.], ack 1449, win 251, options [nop,nop,TS val 3520428 ecr 2128956351], length 0
21:41:15.870998 IP 192.168.10.158.44944 > 182.162.92.143.https: Flags [P.], seq 1906:1944, ack 3979, win 319, options [nop,nop,TS val 3520428 ecr 2128956349], length 38
21:41:15.871190 IP 192.168.10.158.47696 > 182.162.92.42.https: Flags [P.], seq 3906:3989, ack 250398, win 2674, options [nop,nop,TS val 3520428 ecr 2143351527], length 83
21:41:15.871790 IP 182.162.92.143.https > 192.168.10.158.44950: Flags [P.], seq 1449:3650, ack 207, win 122, options [nop,nop,TS val 2128956351 ecr 3520426], length 2201
** capture packet ** end---------------------------------
